id,title,content,text,url,published,source,source_category,publisher,collected_at
32cec0a8cf393b06,Victrola Cuts P&L Reporting Time by 94% After SAP Cloud ERP Migration - ERP Today,Victrola Cuts P&L Reporting Time by 94% After SAP Cloud ERP Migration ERP Today,Victrola Cuts P&L Reporting Time by 94% After SAP Cloud ERP Migration - ERP Today. Victrola Cuts P&L Reporting Time by 94% After SAP Cloud ERP Migration ERP Today,https://news.google.com/rss/articles/CBMickFVX3lxTE1ZZHVZMERPZF9BQTRDVXBPOGNDbXRISlJNY1NqZG9VemFkejB5QnU1dmpzaU1WWU5aS3pLZ29kS0dBemYyY24zSzRZNGZnSnNQMTZKUm9pMlF3V0pfcDYzb0RrV3VFMi10ZUlRNk1jZDZCUQ?oc=5,"Mon, 08 Jun 2026 07:00:00 GMT",Google News - SAP,news,ERP Today,2026-06-22T20:07:38+00:00
d0273d20a9d5e1a9,Fast-track to value with SAP GROW - KPMG,Fast-track to value with SAP GROW KPMG,Fast-track to value with SAP GROW - KPMG. Fast-track to value with SAP GROW KPMG,https://news.google.com/rss/articles/CBMiggFBVV95cUxNR1NlU21vTnI5bXdtMjRHUEpGVXc2M0syLU1idE16eDZyNW9MX19kTV9ZMFpuc0FIRlBaeUNUUmZXX2k2ZUhOWVFXWGFMUm16Q3lXV04wcWpxd0J6U0ZuSU8xOXEzM1dkMXZuVmZ4WjcwTkJBSEhkNmxMRE1LV3hPamhB?oc=5,"Mon, 22 Jun 2026 07:13:22 GMT",Google News - SAP,news,KPMG,2026-06-22T20:07:38+00:00
9a45140b81fbb480,SAP makes a tempting AI offer but only if customers move closer to the cloud - Okoone,SAP makes a tempting AI offer but only if customers move closer to the cloud Okoone,SAP makes a tempting AI offer but only if customers move closer to the cloud - Okoone. SAP makes a tempting AI offer but only if customers move closer to the cloud Okoone,https://news.google.com/rss/articles/CBMiygFBVV95cUxQYml0UU9DTC1yYjEtRlVSM3hxaHQtRU9sdDZqSzFCSktfV0dpbjYtMG95S0JLWThsZFRjcGxmY1JJZ0FYS0Z0UTVPdjFfQW9lY0JCRExfM2x0eGltMThlLWlmWHV2T1MzbkM3Yk9QZU9MbWtHYVYwYnJJQVBEbk8wLVByLWJqSVFUNGpNUXdxZnl0bUszQzNiOGtoZndzdUdqLWlJMWZBNkQ4NXhzd2ZYNUdGei11R2JzMFJINVlzNjB2MTRJQkhnQlZn?oc=5,"Fri, 19 Jun 2026 23:34:53 GMT",Google News - SAP,news,Okoone,2026-06-22T20:07:38+00:00
9280d35d1bc52a4c,SAP Concur in the Age of AI Agents - E3-Magazin,SAP Concur in the Age of AI Agents E3-Magazin,SAP Concur in the Age of AI Agents - E3-Magazin. SAP Concur in the Age of AI Agents E3-Magazin,https://news.google.com/rss/articles/CBMiZ0FVX3lxTE0zenUtNnMzQl9oM2VQcDgtaWVFTDdaZVc3VkhBZnVvMGwtMDY5MzlqWVM2eDBrOW1pVVdUUHNReEhwd1gyNTdEaVVxNnVLQ2k0SVpWMTE5enVhV2dfOWtqTWlqSzFkV1U?oc=5,"Fri, 12 Jun 2026 08:14:56 GMT",Google News - SAP,news,E3-Magazin,2026-06-22T20:07:38+00:00
74cca85d518c6bb4,SAP NS2’s FedRAMP+ IL5 Authorization Opens a New Cloud ERP Path for Defense Programs - ERP Today,SAP NS2’s FedRAMP+ IL5 Authorization Opens a New Cloud ERP Path for Defense Programs ERP Today,SAP NS2’s FedRAMP+ IL5 Authorization Opens a New Cloud ERP Path for Defense Programs - ERP Today. SAP NS2’s FedRAMP+ IL5 Authorization Opens a New Cloud ERP Path for Defense Programs ERP Today,https://news.google.com/rss/articles/CBMiX0FVX3lxTE5rNUp4c1NYTDc2eDRvVjlsdjlFa2VxUXV1NndvaFR4WXQzdWlRYmx4TUNTWFA0VzhrR0FMREc4eDhBTjZmU1BFbzQ0TXAzOGZhY3JTbno5cXpXTTFQVDk4?oc=5,"Sun, 21 Jun 2026 17:44:22 GMT",Google News - SAP,news,ERP Today,2026-06-22T20:07:38+00:00
d0106df736ce61cd,SAP Moves Agent Orchestration into Joule Studio with n8n Deal - ERP Today,SAP Moves Agent Orchestration into Joule Studio with n8n Deal ERP Today,SAP Moves Agent Orchestration into Joule Studio with n8n Deal - ERP Today. SAP Moves Agent Orchestration into Joule Studio with n8n Deal ERP Today,https://news.google.com/rss/articles/CBMihwFBVV95cUxNSnVxMXQzaFNsTmZ4ZENIenM2WmxRQUtNZ0R0LXNmcmQtM3AyaG5Xd2N4WFNjRmFWeDlqWjJpNnAtN2dSVDNtM0ppXzJwMmtVdm9ESk1ETWl1dGZvVDFWdGdOWGFja3VWMEhielZTS3ZUN1p2NFFXd2xCQTM2Njc2ampBUGM2STA?oc=5,"Wed, 17 Jun 2026 18:51:54 GMT",Google News - SAP,news,ERP Today,2026-06-22T20:07:38+00:00
c5ecce9f6c25f4f3,Keynote: How SAP Is Supercharging Developers For What's Next | AI & Agents | SAP TechEd 2025 Luka Doncic (pxjE16D22f) - Mshale,Keynote: How SAP Is Supercharging Developers For What's Next | AI & Agents | SAP TechEd 2025 Luka Doncic (pxjE16D22f) Mshale,Keynote: How SAP Is Supercharging Developers For What's Next | AI & Agents | SAP TechEd 2025 Luka Doncic (pxjE16D22f) - Mshale. Keynote: How SAP Is Supercharging Developers For What's Next | AI & Agents | SAP TechEd 2025 Luka Doncic (pxjE16D22f) Mshale,https://news.google.com/rss/articles/CBMiW0FVX3lxTE40elExRXJQN3hPWW8xcU9HQVhIYnFiYTVoOVhhdlQxOGNtdnRaRktrSDhEZFRPMXp1bWJkWWFlOFlzZGRJUjBtd3EzbzhMRU5ORmlBNDFTcEw4Q1k?oc=5,"Fri, 19 Jun 2026 19:07:43 GMT",Google News - SAP,news,Mshale,2026-06-22T20:07:38+00:00
0e8d395ee1188afc,AI Frontier Models’ Potential Threats to SAP Systems Explored in Latest Onapsis Docuseries Episode Debuting June 25 - Business Wire,AI Frontier Models’ Potential Threats to SAP Systems Explored in Latest Onapsis Docuseries Episode Debuting June 25 Business Wire,AI Frontier Models’ Potential Threats to SAP Systems Explored in Latest Onapsis Docuseries Episode Debuting June 25 - Business Wire. AI Frontier Models’ Potential Threats to SAP Systems Explored in Latest Onapsis Docuseries Episode Debuting June 25 Business Wire,https://news.google.com/rss/articles/CBMigAJBVV95cUxNUmRjZmw0QjRYN3NJTlpEcUM2Nm10bVZQUzlIeGUwb3N5UnZzZ2xoU25WRkxtcDlWMlZQdmhIQ2lMbFV0dHpVOVRULTFoWndBeWlocnFTc1ZOOWJoak14V1B0bDlpY2hXeFpjMFpGS1hWei1YTW1sZ1VoVVhVS2FGSGFlNUpYc2ZsRlhHU0I4S0t6Wk9WTVJ3WTBNdDEwU2RfR2w1ZlBOek5qTTgyY3hiUDJMVS04bU5ZMEpfX2VBTDZDSVhGQ0ZvUVgzTC1CamVOb3BhUjdxbmxCLXYtRG9GUmlMaXVQVWQ2SU0zZ2NfMlVsRUoybkZPODRtZWhvUlZD?oc=5,"Tue, 16 Jun 2026 13:00:00 GMT",Google News - SAP,news,Business Wire,2026-06-22T20:07:38+00:00
4e39df05a1fe8c79,SAP (SAP) Has a Cloud-Backlog and Mission-Critical Workflow Story Bigger Than a Legacy-Software Label - AlphaStreet,SAP (SAP) Has a Cloud-Backlog and Mission-Critical Workflow Story Bigger Than a Legacy-Software Label AlphaStreet,SAP (SAP) Has a Cloud-Backlog and Mission-Critical Workflow Story Bigger Than a Legacy-Software Label - AlphaStreet. SAP (SAP) Has a Cloud-Backlog and Mission-Critical Workflow Story Bigger Than a Legacy-Software Label AlphaStreet,https://news.google.com/rss/articles/CBMiyAFBVV95cUxNMEtNQ3d2NVFUU2xydnZlSUMybzR5QUd0QUlYTU5WdGdGeGN2Rmg0cW5EZFNLQVd5dUhyU1BKRWJub2JjWEVzYmtsVExhekxMdTR4U0hkUHZaOEFTY20ycGNlUEdwaFdLbVhkenQ3bG54QzBmMkpJUFREUEhHUXY4N1hNOGFXV0RCLUpKN3dxZ0RLRHk1Y0tQZGdUR3hONHZFeGpUMW5xS2ZNNi1oY3o1bWRDMzI0VVFWMFNEYmsyNzRzZm9hWFhHYtIByAFBVV95cUxNMEtNQ3d2NVFUU2xydnZlSUMybzR5QUd0QUlYTU5WdGdGeGN2Rmg0cW5EZFNLQVd5dUhyU1BKRWJub2JjWEVzYmtsVExhekxMdTR4U0hkUHZaOEFTY20ycGNlUEdwaFdLbVhkenQ3bG54QzBmMkpJUFREUEhHUXY4N1hNOGFXV0RCLUpKN3dxZ0RLRHk1Y0tQZGdUR3hONHZFeGpUMW5xS2ZNNi1oY3o1bWRDMzI0VVFWMFNEYmsyNzRzZm9hWFhHYg?oc=5,"Fri, 19 Jun 2026 18:12:38 GMT",Google News - SAP,news,AlphaStreet,2026-06-22T20:07:38+00:00
7bfa0232077414b8,SAP Stock Jumps As AI And Sustainability Momentum Build - StocksToTrade,SAP Stock Jumps As AI And Sustainability Momentum Build StocksToTrade,SAP Stock Jumps As AI And Sustainability Momentum Build - StocksToTrade. SAP Stock Jumps As AI And Sustainability Momentum Build StocksToTrade,https://news.google.com/rss/articles/CBMib0FVX3lxTFBibUlwZDUyemotMHhPZzVlZG9tOXdpVmRlVkFIZTczSkUxeWF2dW4ybTVNeVdPbC1TaUR1U2loczZMODQ1dWtpQjhtVkpvYWRQRmQxRkdaOGNUcjZBRnFjODY4eEVfSER0V0lWdWRKYw?oc=5,"Thu, 04 Jun 2026 07:00:00 GMT",Google News - SAP,news,StocksToTrade,2026-06-22T20:07:38+00:00
ea22994161a8e3f6,"SAP Sapphire Interview: AI Agents Will Force HR to Rethink Workforce Management, Says SAP SuccessFactors CRO - ERP Today","SAP Sapphire Interview: AI Agents Will Force HR to Rethink Workforce Management, Says SAP SuccessFactors CRO ERP Today","SAP Sapphire Interview: AI Agents Will Force HR to Rethink Workforce Management, Says SAP SuccessFactors CRO - ERP Today. SAP Sapphire Interview: AI Agents Will Force HR to Rethink Workforce Management, Says SAP SuccessFactors CRO ERP Today",https://news.google.com/rss/articles/CBMie0FVX3lxTE9XYVdEaS1tenZuRDQwbDJlZWRCelhWWjBQb1lxdkh3elRyMzNmeXp6TmNnODZVZ1hELWNoc2Vhd2FZUUZ5WXFsdG9qQy0tZUxxUm43RTBoejdnZVhWNVNMUGh2UUI5NTBfRkdlMU8yNnFQVE4taF9sTU43QQ?oc=5,"Sun, 07 Jun 2026 07:43:20 GMT",Google News - SAP,news,ERP Today,2026-06-22T20:07:38+00:00
97d80dd41b053295,Pathlock Partners with NTT DATA Business Solutions to Deliver Managed SAP Cybersecurity Services Worldwide - PR Newswire,Pathlock Partners with NTT DATA Business Solutions to Deliver Managed SAP Cybersecurity Services Worldwide PR Newswire,Pathlock Partners with NTT DATA Business Solutions to Deliver Managed SAP Cybersecurity Services Worldwide - PR Newswire. Pathlock Partners with NTT DATA Business Solutions to Deliver Managed SAP Cybersecurity Services Worldwide PR Newswire,https://news.google.com/rss/articles/CBMi9AFBVV95cUxPZmZ6WkpTMEdSZlcxa1BKLWlWQlRoWGxTdUJYeE41Nm1GQVpyR0c0cWYxeHhpaU1kWmsyQ09XamZsMDRBS05tVzNJYzBCdUF6dE5odUlZZkFWZG40VGRUbmVrNEQxQUhVemktcWxQN0tlck1vN1ZLTWdDZ0dYQjRleUozdUg5cXhzY1hMaFlWc2RCUkIxZkY5WWljaGtiR2xESUZ5RGJSV2JnUl9pMUYtXzJOWVlIX3dGVS1pZkQ1bzI2M3lBTk43Wk9pWkN4d05uUnFDS3BZZlFnbXFKRmFHXzloaEh1cDhPQnRPdDJBYTRuTTdD?oc=5,"Tue, 16 Jun 2026 13:00:00 GMT",Google News - SAP,news,PR Newswire,2026-06-22T20:07:38+00:00
c1dd4585666fb1d3,All our human developers could be replaced by AI within a few years years - SAP boss - hcamag.com,All our human developers could be replaced by AI within a few years years - SAP boss hcamag.com,All our human developers could be replaced by AI within a few years years - SAP boss - hcamag.com. All our human developers could be replaced by AI within a few years years - SAP boss hcamag.com,https://news.google.com/rss/articles/CBMixwFBVV95cUxOSDg4cmIyWlVTZmRtWlVFX1VRMG5RZG1IMnBmR2xJbDlLMnF6TURNNF92aHZEQ1RPdjBrR2NEMjlaOUE3WDVSR1RqMDlEaERWcm42aWhzS0JqTVVvVTVRT1ItUVBfUnZYMlJ5eGVfdEgxMmlJNmpqalJqUjl4Skp0NjFnc1psdS1kOUZUUUVjR3EwM3VPN2paSkVndnEwUW5wM29CNWhGUjVpUDhRY2s2SFduV1lBMktDOExwR3NQMDNDT08yTUhn?oc=5,"Sun, 21 Jun 2026 22:03:06 GMT",Google News - SAP,news,hcamag.com,2026-06-22T20:07:38+00:00
e9c0b032729774e2,"SAP Is Pushing Autonomous CX Expansion with Parloa, Google Cloud, AWS Partnerships - ERP Today","SAP Is Pushing Autonomous CX Expansion with Parloa, Google Cloud, AWS Partnerships ERP Today","SAP Is Pushing Autonomous CX Expansion with Parloa, Google Cloud, AWS Partnerships - ERP Today. SAP Is Pushing Autonomous CX Expansion with Parloa, Google Cloud, AWS Partnerships ERP Today",https://news.google.com/rss/articles/CBMiekFVX3lxTE9TMVY2RjhnM3gyTTlTam9ERDY4Z1dqRkxZWldRdlpUYTR1MEtxMkNkdVlWZDJ1M2RhSVZJNnVIQ2NmcVdjSXF0SG9RN1drN0Q5Rkt6WmpxYVNHQ0o4cktNcG1saHJrclRkLW51M3NlZ0pPWjNHSlE0bzlR?oc=5,"Fri, 19 Jun 2026 06:52:22 GMT",Google News - SAP,news,ERP Today,2026-06-22T20:07:38+00:00
d040f456a148933d,"SAP Patches Critical NetWeaver, Commerce Vulnerabilities - SecurityWeek","SAP Patches Critical NetWeaver, Commerce Vulnerabilities SecurityWeek","SAP Patches Critical NetWeaver, Commerce Vulnerabilities - SecurityWeek. SAP Patches Critical NetWeaver, Commerce Vulnerabilities SecurityWeek",https://news.google.com/rss/articles/CBMijgFBVV95cUxOd3M3d09EZWZnUk5ucEpBaUtwTHdYTzNWanQ3M0NyMTQzdU5MSUg4UnY0alQzbnFPNDR5YmtUVW1TTG8wajdtVTRYaWZzRXFDbjI5ZmV0bURlcHNoSUZSc1JsU0NkOXRNZGxjQVZlUURoUTNpR25BSlNkcGw3YS1naEl2djU5aUlJWUdNNXRB0gGTAUFVX3lxTE9Nb2ZXdTlMTlVoOTVJTjFqMGxCV2gtX2Y2aUR1SGlwZ1BjWl9NNkxTRDdPekRQeng5dWM0UnBDYVJWX0pfMXBKMlg3Z2oxaFc5NS0yUkVPTlVzaDhYMXNFWUxIV1E4TGRNUVNYZXAwLXpOTE54LXVqNWZYRTZ4bXpNNGJPRHB0eVU0b0tFRlAyWUkyaw?oc=5,"Tue, 09 Jun 2026 07:00:00 GMT",Google News - SAP,news,SecurityWeek,2026-06-22T20:07:38+00:00
75b17ea58f3e5fff,How Capgemini Improves Customer Experience And Hiring Outcomes With SAP AI Guardians Game (eoaiv9GaFd) - Mshale,How Capgemini Improves Customer Experience And Hiring Outcomes With SAP AI Guardians Game (eoaiv9GaFd) Mshale,How Capgemini Improves Customer Experience And Hiring Outcomes With SAP AI Guardians Game (eoaiv9GaFd) - Mshale. How Capgemini Improves Customer Experience And Hiring Outcomes With SAP AI Guardians Game (eoaiv9GaFd) Mshale,https://news.google.com/rss/articles/CBMiW0FVX3lxTE1JajVaWDBSWnlpa0tpY0JBM0pQWGllZC1nU3hKSEROT3lCQURoMjVpdUtHd2dLWWNzSmF2SjlEMG5vMUdmU05rZUFhUUVQcjF2SEJXVHdLNzRzdUE?oc=5,"Sat, 20 Jun 2026 07:07:45 GMT",Google News - SAP,news,Mshale,2026-06-22T20:07:38+00:00
4be3b9196927c409,SAP and Google Cloud deploy agentic commerce architecture - AI News,SAP and Google Cloud deploy agentic commerce architecture AI News,SAP and Google Cloud deploy agentic commerce architecture - AI News. SAP and Google Cloud deploy agentic commerce architecture AI News,https://news.google.com/rss/articles/CBMiqwFBVV95cUxOc0kzMVRLcXQtYUNkS3M1MndyeHBBUTFsYUlOY2UyNS1aUV9CaE15X3ZXcnlqUDdSQWgwcGtpRUstc0tJTl9vbl9Qemt6Zk92ZEQzOUdrMGg5cVFGWmNUcVlObjlfMkFkNWFjNEgtc3FNekxVZ0xQX3E2N0tHNjFFLWNfeEtIZW9zX0hua1Jqekx6U2JvRGJTX2hZdTFNWmRLcHhzb19xS0JlaGc?oc=5,"Fri, 19 Jun 2026 14:05:19 GMT",Google News - SAP,news,AI News,2026-06-22T20:07:38+00:00
da1ccd1e5793f64e,Tricentis California Deal Puts AI Testing Governance in the Spotlight - ERP Today,Tricentis California Deal Puts AI Testing Governance in the Spotlight ERP Today,Tricentis California Deal Puts AI Testing Governance in the Spotlight - ERP Today. Tricentis California Deal Puts AI Testing Governance in the Spotlight ERP Today,https://news.google.com/rss/articles/CBMiakFVX3lxTE1KczNwZWVXVHdmNVlMejNvMlZFdUgydGlDelRGU2w2UmJaRTk4dDZfNzhkWEVEUkVzM1RGa0xKem9lckxFdzBWQ0t0WVp2SVZ1b1ROZG1VQk5VTGdBMVQ3dnppRVFfX2Y0NHc?oc=5,"Mon, 22 Jun 2026 19:32:33 GMT",Google News - SAP,news,ERP Today,2026-06-22T20:07:38+00:00
80fc93d52798aca4,Innormax Launches Enhanced Comprehensive ERP & SAP Business One Insights Resource Hub to Guide Businesses Through Intelligent Digital Transformation - PR Newswire,Innormax Launches Enhanced Comprehensive ERP & SAP Business One Insights Resource Hub to Guide Businesses Through Intelligent Digital Transformation PR Newswire,Innormax Launches Enhanced Comprehensive ERP & SAP Business One Insights Resource Hub to Guide Businesses Through Intelligent Digital Transformation - PR Newswire. Innormax Launches Enhanced Comprehensive ERP & SAP Business One Insights Resource Hub to Guide Businesses Through Intelligent Digital Transformation PR Newswire,https://news.google.com/rss/articles/CBMiqwJBVV95cUxNMDhKS1pOTVZOQThqS0ZsSU1JWWxVMUM0R041RFhob1RCbm5TMk05d040emQyVVFNUm9jZzEwSjJfT1hMUTFwdnpGM0NFMUxXRTc2bFFqZkhKY2Y3d1ZhQ0Y5bUNCd3k4SVNhbWpMX0hNNUdvOVF3OTh3bUZfbEczel9QQ2NaYjQ4a3hlQW9GTm9RekU4SGNKZzRhbmdfcXdIQjRzYW1ja3J3bkotNlpOSXM3R0E5MFhwVjdmSUo3elRiLS0yTnRzT2lVZENxaDZRaFdUbHUwZGF1TWZnSHFpdmE0VmNMX0ZiandyYUVNM05ZYzhnYW1ReXVyRHpoV0dlQXpiOUZnSTd4OFFEdGJQdTRORDVHY1Bmb1FjUkNzVkhGMjUyb1RQUlc4bw?oc=5,"Tue, 09 Jun 2026 10:00:00 GMT",Google News - SAP,news,PR Newswire,2026-06-22T20:07:38+00:00
fcf1dbc7e7625a0a,Tokenomics - the SAP worldview as Chief AI Officer Philipp Herzig admits customers really don't like tokens - Diginomica,Tokenomics - the SAP worldview as Chief AI Officer Philipp Herzig admits customers really don't like tokens Diginomica,Tokenomics - the SAP worldview as Chief AI Officer Philipp Herzig admits customers really don't like tokens - Diginomica. Tokenomics - the SAP worldview as Chief AI Officer Philipp Herzig admits customers really don't like tokens Diginomica,https://news.google.com/rss/articles/CBMitgFBVV95cUxPOW1ieHI3X0hyOUdsR2NXOVhiTzRvcEk1UzBQWUxsNmZUdlRHWE1MRlhJc3V4bVo2eUdfcWVhU1owU1BoVldjc1dHU25weUlfWW4wbG9yc080TmdUOVotaWxVMWlHYkpOWVoyTHVwVmpaVk1HalVQMTRjZEVDeE1KalRUNGpIVXRjQmozMXpUWHA1Tl9RUVBJcmhzSjNWZnFTTmotUEk2aDFYUHBRQ3VadXphUE9Zdw?oc=5,"Thu, 11 Jun 2026 09:23:34 GMT",Google News - SAP,news,Diginomica,2026-06-22T20:07:38+00:00
5ae74a0637c31da3,SAP says human-in-the-loop review is key to moving enterprise AI agents from POC to production - digitimes,SAP says human-in-the-loop review is key to moving enterprise AI agents from POC to production digitimes,SAP says human-in-the-loop review is key to moving enterprise AI agents from POC to production - digitimes. SAP says human-in-the-loop review is key to moving enterprise AI agents from POC to production digitimes,https://news.google.com/rss/articles/CBMilAFBVV95cUxOaEJUeWQ3cHMwS1ZrNTJObnd0clQydmVBZlpxTl9SczE4NUNfOE1QT0xFSjZOenlFNDVhSGY4T0E5ZVRtRUp3QldkLTBNSXV5ZWM0UTNWUzhRNlBmR2hmUFNRdDFnb1VUZllfdzliRUlPQ2ozNnFEbEdUaDUwbW1LN083Y3hSaElLbkhneEdsNVRrcnNj?oc=5,"Mon, 15 Jun 2026 09:19:56 GMT",Google News - SAP,news,digitimes,2026-06-22T20:07:38+00:00
c3a03a487df9f629,"As Demand for AI Execution Grows, enosix Launches arnold™ - Business Wire","As Demand for AI Execution Grows, enosix Launches arnold™ Business Wire","As Demand for AI Execution Grows, enosix Launches arnold™ - Business Wire. As Demand for AI Execution Grows, enosix Launches arnold™ Business Wire",https://news.google.com/rss/articles/CBMisgFBVV95cUxNR1RCRmU5MzAzUWZkaVg5cDBROWJ2NGJpOFVfQ3lCQ1V0Z3NqY2VRbFpFZkN5SUxlb1k1Q1N0WlpCcnZPWVRRSEZ3NVBJcmJYXzZYZVBxenB2NmpfNTlRa3JBX0JFQ2djdWlCbTJMTXQzMEt1eGlmdmt6Uk02cXpUaXd5Mjl5NFdHWWZTWHhyUWItMTFZNDctZWJiVnVwOExfdDMtcjRMSldQRlVjWkwyY1Z3?oc=5,"Tue, 16 Jun 2026 13:00:00 GMT",Google News - SAP,news,Business Wire,2026-06-22T20:07:38+00:00
20ed3a4ba09f1cc9,project44's Real-Time Multi-Modal Visibility Solution Now an SAP Endorsed App Available on SAP Store - GlobeNewswire,project44's Real-Time Multi-Modal Visibility Solution Now an SAP Endorsed App Available on SAP Store GlobeNewswire,project44's Real-Time Multi-Modal Visibility Solution Now an SAP Endorsed App Available on SAP Store - GlobeNewswire. project44's Real-Time Multi-Modal Visibility Solution Now an SAP Endorsed App Available on SAP Store GlobeNewswire,https://news.google.com/rss/articles/CBMiggJBVV95cUxNWDRRc1ZRWWd0NDJ2amNRcUdSNFBSWTlrelUzWlltcURfdjNlSlg0VG9IeXRNOXBpVERCdURjOGxBblREVUNub3BrdlVBNXpBLWE1ekg2bmh1bmN4RWN6NFlNVHBYeUc4Tzg0ZGVDTzVkbWEwTW5TWTlNRW80ODNIRG95MTEwVWNxNVdxdUZ2QXNiWjBXaUhGandYVkpLTV94TVRDNUc1X2VybWhUaWRIaHg0Y19EZHZXcVF5ajl6SFNvWkp6OHNRSzVybVFiM0o1MElQQ2lmODluV1prZDJEbk1GUnNpMldRdVB4cDVidHpRNVd6THdhVU9SS0ZUcWFiWGc?oc=5,"Tue, 16 Jun 2026 13:00:00 GMT",Google News - SAP,news,GlobeNewswire,2026-06-22T20:07:38+00:00
b96af5918d9cfc14,SAP stock tumbles 3%: why Oracle's AI capex surge is hitting software shares - TradingView,SAP stock tumbles 3%: why Oracle's AI capex surge is hitting software shares TradingView,SAP stock tumbles 3%: why Oracle's AI capex surge is hitting software shares - TradingView. SAP stock tumbles 3%: why Oracle's AI capex surge is hitting software shares TradingView,https://news.google.com/rss/articles/CBMiywFBVV95cUxQcV81TG5yNHpkLTJhSjg5Qm9jWjdyNzFBNVUwUll0c09kR2ZibzQ3c3BGRnJBeXdDYWlFWDdRbWUtMG5YVkIydFhpRG1Uazh5azRJbVJPX0hPTUJSUk1EUmRzdVU4SDFqQjNRSVBBNlI5WDNJcG9Cdk1DaEVCcEt5ZEV3cHdLS0pmQ0RWOFEteFhFMWtvdDhWbkU2cVVhTUFVLVhxTzdWemxqRFhJTWpaNWI0ZVhGdlUxcndyaTlMNDNnTGFiM19EX3NMWQ?oc=5,"Thu, 11 Jun 2026 07:00:00 GMT",Google News - SAP,news,TradingView,2026-06-22T20:07:38+00:00
b802c4734aab2f89,What Is SAP Joule For Consultants? When Is Mother's Day (qEdXkMeLhG) - Mshale,What Is SAP Joule For Consultants? When Is Mother's Day (qEdXkMeLhG) Mshale,What Is SAP Joule For Consultants? When Is Mother's Day (qEdXkMeLhG) - Mshale. What Is SAP Joule For Consultants? When Is Mother's Day (qEdXkMeLhG) Mshale,https://news.google.com/rss/articles/CBMiW0FVX3lxTE14SzRyZEZ4Y1RGS1RqM05jZ0JZT0RIQXc0c3RSMkp1b0NKQmlpM0FWMFY5a3RsRmkwQk9CVWN2Sl9JUU92YzRxYWplQzJ1RzNMaTg4X3d3OUZsYlk?oc=5,"Wed, 10 Jun 2026 21:28:25 GMT",Google News - SAP,news,Mshale,2026-06-22T20:07:38+00:00
3eb6476c69eefdab,Giotto.ai Collaborates with SAP to Advance AI Reasoning Capabilities in SAP Joule Agents - TradingView,Giotto.ai Collaborates with SAP to Advance AI Reasoning Capabilities in SAP Joule Agents TradingView,Giotto.ai Collaborates with SAP to Advance AI Reasoning Capabilities in SAP Joule Agents - TradingView. Giotto.ai Collaborates with SAP to Advance AI Reasoning Capabilities in SAP Joule Agents TradingView,https://news.google.com/rss/articles/CBMi2gFBVV95cUxPc2JYTzE0RmRZM1pYa1BwQXlPVVVPOXdna1NyQ0xvM19uU3JiMFJtWVBSZEl5NlBDWTB3eGhSWm4tWTJzZ0lDQlZ5NXZRYkVjZmhhWURUU2RlOWVOdHh2U2dGMWdrU0dyczVtaWNhTU9FRWR6TVZ2QXFPOGZmV2pFSmRDdFFLTlVhWHVsMkNYZWYzZzFSakV5MHNsbzFBVTNUc2ZtbGdYVXdBTTNaSy1BbFpYcUVCbkpBZlZHbUplS1Q2NXZmVlVKdm8ydFltMkRGV3A2cHlrX2JNUQ?oc=5,"Sun, 07 Jun 2026 07:00:00 GMT",Google News - SAP,news,TradingView,2026-06-22T20:07:38+00:00
8c3f320358d7441d,SAP (XTRA:SAP) Stock Could Be 42.8% Undervalued After Its Cloud And AI Push - simplywall.st,SAP (XTRA:SAP) Stock Could Be 42.8% Undervalued After Its Cloud And AI Push simplywall.st,SAP (XTRA:SAP) Stock Could Be 42.8% Undervalued After Its Cloud And AI Push - simplywall.st. SAP (XTRA:SAP) Stock Could Be 42.8% Undervalued After Its Cloud And AI Push simplywall.st,https://news.google.com/rss/articles/CBMiwwFBVV95cUxPejFidjVQLWJDUFEzdkl5Vm0zNm1Cam1sT3pVZWJGSlRmREtTU21wT0oyVW9BQVBVUTE2X0hTM0VuMGdvUlNKV2RCcGlXZlNYRy1taDRNOEY4NjRUbDZCY2s3YkFjOHgzLXo3U1lTSDlQUUZOVzA5dnJtLXBXVFdsMXhPQ2JKeXh1ZGNuMjJvdTEzZGo1d214UHlIbWMtSzFMS3ZOQ2l6a0JYZU43dE5kN2RSNmkyMW55ajRMOHZ0MHZFeGfSAcgBQVVfeXFMTXZ6UTdFMU9vdGQzN0xGcF9jeVVYNlE5RmZLVHR4RTJWRy16RmhoYzVKaERhNGxSWklhTloxaDhMQk1sZGF2YXJXYVJwWTFLS25QeHJzVlhnczhScGdtQjRHWG5yd1RUUk9jVWV0LVZ4SVZMcGVtLXFVandHUUw2VjlxdFpYRWo4X2ZKTFZzanQ0bVpYSGNISW5EYWt1eG9kcHRLMWg5RXBFUG8wdjhsaXJsYXpTMEVPaDcyTmNxb0wyMXVxUlZWRGw?oc=5,"Thu, 18 Jun 2026 15:48:32 GMT",Google News - SAP,news,simplywall.st,2026-06-22T20:07:38+00:00
7f50dedd6e32a0a8,XTEL Ends CPG's SAP Compromise with AI-Powered Revenue Platform - BriefGlance,XTEL Ends CPG's SAP Compromise with AI-Powered Revenue Platform BriefGlance,XTEL Ends CPG's SAP Compromise with AI-Powered Revenue Platform - BriefGlance. XTEL Ends CPG's SAP Compromise with AI-Powered Revenue Platform BriefGlance,https://news.google.com/rss/articles/CBMimwFBVV95cUxPcHI2ZVh6dGlFWlNHeXFvemIyWXVfOVZNZWVYVGJTVFpad3NhNnp4cGpSZ3hLU0ZycEZYYVFpRmFvZlhuTmlHR1ByVTJUV01ONFR5SXZRM3pfRy1NZ1ZyMFVrbXdsVmI4aGRrU0JHcWdoaGZLcVlxTEx0RHpabFkzNS1JbTktZWE0ZG0xZm9XR1hCQWgyWEZmOXFXQQ?oc=5,"Mon, 22 Jun 2026 11:00:00 GMT",Google News - SAP,news,BriefGlance,2026-06-22T20:07:38+00:00
251a938d063f88df,"Dutch critical infrastructure lags Europe’s cloud sovereignty divide, SAP executive warns - Computer Weekly","Dutch critical infrastructure lags Europe’s cloud sovereignty divide, SAP executive warns Computer Weekly","Dutch critical infrastructure lags Europe’s cloud sovereignty divide, SAP executive warns - Computer Weekly. Dutch critical infrastructure lags Europe’s cloud sovereignty divide, SAP executive warns Computer Weekly",https://news.google.com/rss/articles/CBMizgFBVV95cUxQMXNnUDBlOHctOTNwWmlETGc0RTk2dFdrUnVqM0stckZuR1dLQ1JLYXRBUzVPWUFuQWxONHd1UGJaMUU2V05EamM5NlI5emdicUtWU1ZHYkk4TWs3RGNGNThKTDRldzBkNmxBcUp5V3RJZ3FpTG5QbE1rREx1V2FTRjhuWFlvSVVJcEhmc09XT0Z6U01ITW5iUjM4YUZXbGpzTVJZRzF2ZWxBeTItSnhuOHFlakpud1lHVzRreDBXZ1AwQWJSYTNjWTh2ZkdoQQ?oc=5,"Wed, 10 Jun 2026 07:00:00 GMT",Google News - SAP,news,Computer Weekly,2026-06-22T20:07:38+00:00
6e09abff462ec2c3,Giotto.ai partners with SAP to enhance AI reasoning capabilities - Investing.com,Giotto.ai partners with SAP to enhance AI reasoning capabilities Investing.com,Giotto.ai partners with SAP to enhance AI reasoning capabilities - Investing.com. Giotto.ai partners with SAP to enhance AI reasoning capabilities Investing.com,https://news.google.com/rss/articles/CBMivAFBVV95cUxQbXlqUi00WXQ5X1lwZk1scGh6T2lVQjNBMWppRHJvRmVrYnRNbWlmSE1GWENGTkNNVUtTS0o1Q2pScVhqVm15aWtTWDdPamszVlBZd1R2QzRnZDhBdlNHanZHcWJDX2k4alVPMWU5bnFXMkJ2WE1pT2NJaEhSaTFaZTg3YlRYWG9QcGZ6b1VVNVJGZ2ttSEZFT1pHREVFVjdPNHhzQV9lbVFHc1lGRVBqT1dYR3RMRXJvYWt4LQ?oc=5,"Mon, 08 Jun 2026 07:00:00 GMT",Google News - SAP,news,Investing.com,2026-06-22T20:07:38+00:00
d9a54d1d09700ec6,SAP Launches Joule in SAP for Me Portal - Grocery Trade News,SAP Launches Joule in SAP for Me Portal Grocery Trade News,SAP Launches Joule in SAP for Me Portal - Grocery Trade News. SAP Launches Joule in SAP for Me Portal Grocery Trade News,https://news.google.com/rss/articles/CBMiY0FVX3lxTE9EWlBpZkYwMzBSeU16d3MxVzMxdDdLQk5vWlNuN0NaTmFyT0ZpcTlPekVva2t0aVh2Tjk5YUNLVVZEaHVIRHRXZmFLbW1lWk41X0Q1MXVvdG5fcmotXzlSd0pmQQ?oc=5,"Sat, 13 Jun 2026 09:53:44 GMT",Google News - SAP,news,Grocery Trade News,2026-06-22T20:07:38+00:00
4fa4400514a259ef,SAP stock tumbles 3%: why Oracle's AI capex surge is hitting software shares - CryptoRank,SAP stock tumbles 3%: why Oracle's AI capex surge is hitting software shares CryptoRank,SAP stock tumbles 3%: why Oracle's AI capex surge is hitting software shares - CryptoRank. SAP stock tumbles 3%: why Oracle's AI capex surge is hitting software shares CryptoRank,https://news.google.com/rss/articles/CBMisAFBVV95cUxQQk5RTHBlRzZjZlVXSndHV0FrcGpNQ1VkeTZ6NXRUVW9NS3hjakJ4ZFJjckZWbkxXQ3hKY05YQ3JHeVYwM0hVUC1Pa1FFNUlwR003YkxNNGZyRktaTl9uT1BYckZtMFFsTXpVWVQ5Q2I1ZjlXMEVnUl9fVmxmOEt0WnE1Q09hNTBjV2pMdUc3MjJCM0QwUVN1LWF5RkFLdUs1NUhaQjBscXJ3Q1FLYXFYUg?oc=5,"Thu, 11 Jun 2026 07:00:00 GMT",Google News - SAP,news,CryptoRank,2026-06-22T20:07:38+00:00
b437bfa96ef85bb8,"As Demand for AI Execution Grows, enosix Launches arnold™ - Yahoo Finance","As Demand for AI Execution Grows, enosix Launches arnold™ Yahoo Finance","As Demand for AI Execution Grows, enosix Launches arnold™ - Yahoo Finance. As Demand for AI Execution Grows, enosix Launches arnold™ Yahoo Finance",https://news.google.com/rss/articles/CBMinAFBVV95cUxNMHB0UUN1Yk9pWmE1clp3TlVJZVI0LTNxVGhTUWJDeW5jTS1vSmhVdk5JNGtRdUY3OVRucEV6ZExDdDN5MzZMTTF3aVo0Q3hfWEYwZmR0My1DSnRzWk82UE1za0FPMkNrMmdvLUwzZnBDRDFEbTRTZmNaZnlRZkYtUW1FQmotTDgteDVWZ2lKN2tFa3k3bHduWUljUFA?oc=5,"Tue, 16 Jun 2026 13:00:00 GMT",Google News - SAP,news,Yahoo Finance,2026-06-22T20:07:38+00:00
