id,title,content,text,url,published,source,source_category,publisher,collected_at
bb11a9a9bb7da517,SAP’s AI-Native North Star Architecture: Technical Backbone of the Autonomous Enterprise - SAP News Center,SAP’s AI-Native North Star Architecture: Technical Backbone of the Autonomous Enterprise SAP News Center,SAP’s AI-Native North Star Architecture: Technical Backbone of the Autonomous Enterprise - SAP News Center. SAP’s AI-Native North Star Architecture: Technical Backbone of the Autonomous Enterprise SAP News Center,https://news.google.com/rss/articles/CBMirAFBVV95cUxQaXRpT2t4S0h4Y1ZkTElWczlOcUJvTl94OTF4eENqeGg3RjRrYTV1X3J0S1UtWk82WkRDM3FIQnBjTDFkb19BbHpyQ3JmakFzMFdxUHZualRodC02Z09BT3d1R2NZcTZlZ25ZanF5djYtSEViSTB2Zk0wbl94VDk2aEFSOE9KYy1Dc3hvTFlIYkh0WlhIT19aZnlwdUk3cno0TzZ3TE5wY1FISFM0?oc=5,"Mon, 08 Jun 2026 07:00:00 GMT",Google News - SAP,news,SAP News Center,2026-06-22T20:07:38+00:00
6a3ade22f41379ae,SAP’s Autonomous Enterprise Pivot And AI Push Shape Valuation Story - Yahoo Finance,SAP’s Autonomous Enterprise Pivot And AI Push Shape Valuation Story Yahoo Finance,SAP’s Autonomous Enterprise Pivot And AI Push Shape Valuation Story - Yahoo Finance. SAP’s Autonomous Enterprise Pivot And AI Push Shape Valuation Story Yahoo Finance,https://news.google.com/rss/articles/CBMioAFBVV95cUxPaE9CUmhleFNnU3ZRbTA0WUp3UGZaZDQ2NllZa1Z2bkRrcnRSMGVXTW81eUlxOEVmaWRkSGxCSkFDN3MxMHNVS0hDR2d1Y0hJQUc1YVBBUE1tYXBJQ0ZwbFNHNXZtN2wwbnR3TnIzdktFcmYxT0V1LWs0Z1VFNzRvMUsyQ3djSEdZUFkwWnM2ek51cFdzaXg0QlN3SnFvTy1L?oc=5,"Sat, 06 Jun 2026 07:00:00 GMT",Google News - SAP,news,Yahoo Finance,2026-06-22T20:07:38+00:00
7a41850d7ed680c0,SAP And AI Sovereignty - Forbes,SAP And AI Sovereignty Forbes,SAP And AI Sovereignty - Forbes. SAP And AI Sovereignty Forbes,https://news.google.com/rss/articles/CBMigAFBVV95cUxNaVZlOURQYkNsOXlTZmxsYzlRSDIwS2RGal9JUzNmWTBaVmQtT09YbV9uVEpSVVExTUpWR2V4QUhVSmZiNU05SXlVWkRUdG5DMXRuWGR6VVdRLW5xN3FOT3dwSXRPd3FNU0g4N0h3OTRJc0ZXZUdFcllJWG5pQld3TA?oc=5,"Thu, 11 Jun 2026 07:00:00 GMT",Google News - SAP,news,Forbes,2026-06-22T20:07:38+00:00
fa44d0fb86baf2d7,Transforming ERP Business Process Operations with Agentic AI - Amazon Web Services (AWS),Transforming ERP Business Process Operations with Agentic AI Amazon Web Services (AWS),Transforming ERP Business Process Operations with Agentic AI - Amazon Web Services (AWS). Transforming ERP Business Process Operations with Agentic AI Amazon Web Services (AWS),https://news.google.com/rss/articles/CBMifEFVX3lxTE9WMFNIb1J4TktvaWtYZ29JYXRHMmxoekZJTmpHSS1aTkJ1VjB0ZjlaWnoxaXZIVGNJa194bm83MjZwV3lGeXhSakxsY2w2T0ZsSnBIYVBkU2hwYTJJNENFTUcybnRKcnN4MTRUdkR6Ul9WVVd1REtmQ1lhUko?oc=5,"Thu, 04 Jun 2026 07:00:00 GMT",Google News - SAP,news,Amazon Web Services (AWS),2026-06-22T20:07:38+00:00
d045fdf5ca61c372,AI Needs Context: How OpenText and SAP Are Building the Future of Enterprise Intelligence - OpenText Blogs,AI Needs Context: How OpenText and SAP Are Building the Future of Enterprise Intelligence OpenText Blogs,AI Needs Context: How OpenText and SAP Are Building the Future of Enterprise Intelligence - OpenText Blogs. AI Needs Context: How OpenText and SAP Are Building the Future of Enterprise Intelligence OpenText Blogs,https://news.google.com/rss/articles/CBMitwFBVV95cUxQMmVrMWR0bmQ2bVh2bHhILXF5c0JJdXBEaDZsWEhkYVBIdnZpaU9tdk01a3NUTkI1ZXhsVGJTMnRGQzIxamNSajNPeTYzM2t1LVFDSkNGd3loMVhQVF9YRkNfQ2ZhaGlmREtldGowX3pDWDExQjNqSURWQ1ZvaFRucDlFVWJBLTYwNzBPYzlKWFNEejRsM0REZ05CdXdXdjlVZ3RQUEhIR3YyVDdpTXJOZWNMblRzRzg?oc=5,"Mon, 08 Jun 2026 07:00:00 GMT",Google News - SAP,news,OpenText Blogs,2026-06-22T20:07:38+00:00
884f0e01d6731745,A steady stream of ERP innovations from SAP - E3-Magazin,A steady stream of ERP innovations from SAP E3-Magazin,A steady stream of ERP innovations from SAP - E3-Magazin. A steady stream of ERP innovations from SAP E3-Magazin,https://news.google.com/rss/articles/CBMiZkFVX3lxTE01TXF5M2wzRmVCM3VoaHZrWjNtemVZUk1jMlhocnJWOTdVOTZ6Z2tldWpPb1NGczV1UWF0T19hTlB1aml3Qm02NEtHNThGMTVfTmx0VHc4eWpibUtNbXM2bmxyZzJhZw?oc=5,"Wed, 03 Jun 2026 07:00:00 GMT",Google News - SAP,news,E3-Magazin,2026-06-22T20:07:38+00:00
15f81c45595028be,Why SAP S/4HANA Migration Alone Won’t Make You AI-Ready - ERP Today,Why SAP S/4HANA Migration Alone Won’t Make You AI-Ready ERP Today,Why SAP S/4HANA Migration Alone Won’t Make You AI-Ready - ERP Today. Why SAP S/4HANA Migration Alone Won’t Make You AI-Ready ERP Today,https://news.google.com/rss/articles/CBMickFVX3lxTFBXUFY2eVVHTzRDQk90VGFzMjU2NzFRUDlIbDh1RkNGSTZsWlJZSE51OF91ajlkRnotbnFHUmFlMFY4Nk5mVVBKTWtDd0tIRjZQNHduVF9OZHdJNzBndnRDNVF4MUdJZDVHZjBhWWJPU0twQQ?oc=5,"Fri, 12 Jun 2026 07:00:00 GMT",Google News - SAP,news,ERP Today,2026-06-22T20:07:38+00:00
e5c53ef85663ec46,Moving beyond proof-of-concept: How to build enterprise AI on SAP that delivers real business impact - Capgemini,Moving beyond proof-of-concept: How to build enterprise AI on SAP that delivers real business impact Capgemini,Moving beyond proof-of-concept: How to build enterprise AI on SAP that delivers real business impact - Capgemini. Moving beyond proof-of-concept: How to build enterprise AI on SAP that delivers real business impact Capgemini,https://news.google.com/rss/articles/CBMi6wFBVV95cUxQV1FMVkRYa1ZWZmYtTzJsUTFuc3hRampIT0RDRjB5MVRMTjBEbFFtQ0hBcllfT2dCWVV2dXlPdXp0Qm9qemxRTkRrUnczam5uUHp0UDZLTjFZNjRaQkJfb1YwTzAxaFZuMG9DazlmbGgwMkdGVEtsekM0SEx5alRHWUV0ZmdaLWtka1F3clJ1Z0lxSVVQLTd2N2ZEUkl4NUVxVlpFS25MRGpjQURtVDhYMkdSczNMUnFVY3o3M0UzUmEyUzRWWFNYbURJR0lDZGlocWR0UXVqelB3NHYtbzh4SHF3LWdqZDZMMTNB?oc=5,"Wed, 03 Jun 2026 07:00:00 GMT",Google News - SAP,news,Capgemini,2026-06-22T20:07:38+00:00
bb00defa959c55a3,AI-led managed services for SAP AES can fund innovation - PwC,AI-led managed services for SAP AES can fund innovation PwC,AI-led managed services for SAP AES can fund innovation - PwC. AI-led managed services for SAP AES can fund innovation PwC,https://news.google.com/rss/articles/CBMisgFBVV95cUxOTUJ2bjZjQkowVHhTSEZEcFlxb1c5d0JReHQ2OXFrOVFPclAyclk0ZEUyZjJMXzBVbi15dkg3aWdKMUt3bU1pSkJGcVJvZmhJWHk0Q1M0QzJ4TEdxUy1xUU81T213bFhqOC1TQ2h2VGtOSkpLU3VIdjByeEJtY0RBNGRMR0h4US1VZzBHRXVCaEVIMFlnVmU5VG5LRFdZdjc4RXdkeUpyUHR6MEJWNU52ZTF3?oc=5,"Tue, 26 May 2026 07:00:00 GMT",Google News - SAP,news,PwC,2026-06-22T20:07:38+00:00
883ec30be7f9def1,AppZen Autonomous AP for SAP S/4HANA Cloud Private Edition Achieves SAP®-Certified for Clean Core with RISE with SAP - PR Newswire,AppZen Autonomous AP for SAP S/4HANA Cloud Private Edition Achieves SAP®-Certified for Clean Core with RISE with SAP PR Newswire,AppZen Autonomous AP for SAP S/4HANA Cloud Private Edition Achieves SAP®-Certified for Clean Core with RISE with SAP - PR Newswire. AppZen Autonomous AP for SAP S/4HANA Cloud Private Edition Achieves SAP®-Certified for Clean Core with RISE with SAP PR Newswire,https://news.google.com/rss/articles/CBMi_wFBVV95cUxOYklfaFBvNndnX0lyTzFCX2ZtQ2FtaXBHb2FodFh1bDdhdGlod1BMdjM0eF9rZlhmQk90eVBQUnFKTURNYThiWlMyVHdBZDBfYXZNNi00MVJPblVhTFdwV0lMSnVXal9TaXQyZ3F2aUdKb3ZiWWFPRUtqVUcxOFhDbHJBenVMVnpXeE5sMGxjdVBpdFA3aVNSTlVSQU5iR1hLSHhSM0oxSVp4M2hlcWZPTnVNOTh5R1ozME9XdUhuZTRDcDJQX0gtYTNlQUd6cHF1eDRaQzVva1pZSTNMT1F4OTZjamYwVWNmS2hrMGd4ZmV4QlM2UWRRNEFwVU53eGs?oc=5,"Tue, 16 Jun 2026 11:00:00 GMT",Google News - SAP,news,PR Newswire,2026-06-22T20:07:38+00:00
fe1402aedcc6fb9e,SAP SE Stock Forecast | Business AI Platform Launch - Capital.com,SAP SE Stock Forecast | Business AI Platform Launch Capital.com,SAP SE Stock Forecast | Business AI Platform Launch - Capital.com. SAP SE Stock Forecast | Business AI Platform Launch Capital.com,https://news.google.com/rss/articles/CBMif0FVX3lxTFBXeU00VG11RC1adlY5VkhuaDB3YllkZ0lWX3hUeU01NFNPUTllZ3RYZlBkYm9vLWpJOWJTU1EzbkwwYm9iTExxUV82d0k3NmpEckN3Z0RyNVlWYW0xYlpuZzVlRW1Yd1JkWmg0cGF6Vmx1TWQ5Z2NCeW1LZng2eEE?oc=5,"Tue, 16 Jun 2026 14:16:00 GMT",Google News - SAP,news,Capital.com,2026-06-22T20:07:38+00:00
7be5dbff01baa381,"SAP Launches Joule in SAP for Me: An AI-Powered Gateway to Insights, Support, and Guided Actions - SAP News Center","SAP Launches Joule in SAP for Me: An AI-Powered Gateway to Insights, Support, and Guided Actions SAP News Center","SAP Launches Joule in SAP for Me: An AI-Powered Gateway to Insights, Support, and Guided Actions - SAP News Center. SAP Launches Joule in SAP for Me: An AI-Powered Gateway to Insights, Support, and Guided Actions SAP News Center",https://news.google.com/rss/articles/CBMib0FVX3lxTFAtdU5sbWlfSE5sQ2treGdEcUJaSlhGNEdLVnNRX0djUHlpUGFDd3ZjMXVDbWU5ZlozdUNPVklmblp4MEFwV0Ixb0Nnc2ZqTGJOdW92cVJYcHpvWndqZXB0Q0tTbmZtd1JnNWg4WHV4Yw?oc=5,"Thu, 11 Jun 2026 07:00:00 GMT",Google News - SAP,news,SAP News Center,2026-06-22T20:07:38+00:00
ac0433b42c376a06,SAP (XTRA:SAP) Expands Enterprise AI Push With New Partnerships And German Security Approval - Yahoo Finance,SAP (XTRA:SAP) Expands Enterprise AI Push With New Partnerships And German Security Approval Yahoo Finance,SAP (XTRA:SAP) Expands Enterprise AI Push With New Partnerships And German Security Approval - Yahoo Finance. SAP (XTRA:SAP) Expands Enterprise AI Push With New Partnerships And German Security Approval Yahoo Finance,https://news.google.com/rss/articles/CBMimwFBVV95cUxPNTY4cXliUDBRNnFtZDA0bnZPUUJNU2ZmQkZRRWFnbDR5a0VhWXU5TUY1RTd2dkxfMG02MlNXV2RUcWZ2SnJHZnFWalRlbElKUkR1d19sYmlYTnFsVEVjT1VNUERKNUZyUkUxdkhZU1RTdmpzYTI1eVc4Z2UzbmlkLTdmWE9XdmJTRUo5Zm1uYmZaN1lKaXY3MnBLSQ?oc=5,"Thu, 18 Jun 2026 18:15:57 GMT",Google News - SAP,news,Yahoo Finance,2026-06-22T20:07:38+00:00
85231df06880ba73,Autonomous Supply Chain: Why Agentic AI Is Rewriting the Operating Model - SAP News Center,Autonomous Supply Chain: Why Agentic AI Is Rewriting the Operating Model SAP News Center,Autonomous Supply Chain: Why Agentic AI Is Rewriting the Operating Model - SAP News Center. Autonomous Supply Chain: Why Agentic AI Is Rewriting the Operating Model SAP News Center,https://news.google.com/rss/articles/CBMiowFBVV95cUxPak9iLVpHbXdFVVFDWnFfeEp0TXZ6MEliRmpWNVNuclZFVV83Qm1aTGN3bXVHejhqaTRKUzRmbjVSc2pRVzlIUV9McW9jenpSRWpDWWFCVzYxM2NId0MtdGx0X1lfNjFoV0NLQURFbFMtdkc5Wl93YmR5RFpSYnVMRHk1eDVpRWRwMUNjY0FlS3h3YmY3eGdpOXpRVkRmUmpQZ0Vr?oc=5,"Thu, 04 Jun 2026 07:00:00 GMT",Google News - SAP,news,SAP News Center,2026-06-22T20:07:38+00:00
5dd22d5942fdbac3,SAP BSI Cloud Approval And AI Plan Focus Investor Attention On Stickiness - Yahoo Finance,SAP BSI Cloud Approval And AI Plan Focus Investor Attention On Stickiness Yahoo Finance,SAP BSI Cloud Approval And AI Plan Focus Investor Attention On Stickiness - Yahoo Finance. SAP BSI Cloud Approval And AI Plan Focus Investor Attention On Stickiness Yahoo Finance,https://news.google.com/rss/articles/CBMilAFBVV95cUxOYlR6UE1TejhpbllVX0tRSkZlbDQ2ZXZOdi1nbEFpc25MSm14bDJyYURhRzFSU0VPeUNqdGVURVVXQmtSLWp3WHRpOUszSkwxYV9kNkV4VHBsOE9wWkg4ckJFLUtjRTN2c2dmZnR3T1BPeHdFVHU0T1RKYkFySVNWNVFSWXVNblNNXzZuaGI3MFdHdGVQ?oc=5,"Wed, 10 Jun 2026 07:00:00 GMT",Google News - SAP,news,Yahoo Finance,2026-06-22T20:07:38+00:00
ee6712b3959e6406,Navigating the Transition from SAP Solution Manager to SAP Cloud ALM - SAP News Center,Navigating the Transition from SAP Solution Manager to SAP Cloud ALM SAP News Center,Navigating the Transition from SAP Solution Manager to SAP Cloud ALM - SAP News Center. Navigating the Transition from SAP Solution Manager to SAP Cloud ALM SAP News Center,https://news.google.com/rss/articles/CBMid0FVX3lxTE5VODN2WmQtMmJLdGRmRGVpei1GVEt0N2lBYWgwS21TOFY1TVlzOG1ZWEwteWFfQ1FSSm9IQjE5d2V3UmpNVzdqSGtaY0Y4ZFE1YW5aNHNQZFZBYktFTDlzaF9jOWV4N2lTR2hpOGxxNGZJbEVRaG9B?oc=5,"Thu, 18 Jun 2026 11:18:29 GMT",Google News - SAP,news,SAP News Center,2026-06-22T20:07:38+00:00
c85ade133829e014,"SAP Opens Data Center in India, Underscoring Expertise in Data Federation and Deepening Commitment to the Region - SAP News Center","SAP Opens Data Center in India, Underscoring Expertise in Data Federation and Deepening Commitment to the Region SAP News Center","SAP Opens Data Center in India, Underscoring Expertise in Data Federation and Deepening Commitment to the Region - SAP News Center. SAP Opens Data Center in India, Underscoring Expertise in Data Federation and Deepening Commitment to the Region SAP News Center",https://news.google.com/rss/articles/CBMipwFBVV95cUxOTm82TGNIRWd5V25xcnMwaGQwWVpnS09RbURXMjNHa0s0dzNJc2xjeUdpc2tldFFtMnRrcVNlSERmNGY0eFRiR1BYeE40c09JejJDTHZnQU5lNDNYQ2h4MVA3UG02ZTVjMk1tWWMtS1NBbmJPek9mT1Q0VV9OTXhLV3R0T2NFTkRJdjV5azNKVFE5dHVSY0ZtODlIT3dmV0JCaWRMbmhxSQ?oc=5,"Fri, 12 Jun 2026 07:00:00 GMT",Google News - SAP,news,SAP News Center,2026-06-22T20:07:38+00:00
0bce4589c104fc06,Salt River Project’s 5 Benefits of WalkMe for SAP Business Suite - SAP News Center,Salt River Project’s 5 Benefits of WalkMe for SAP Business Suite SAP News Center,Salt River Project’s 5 Benefits of WalkMe for SAP Business Suite - SAP News Center. Salt River Project’s 5 Benefits of WalkMe for SAP Business Suite SAP News Center,https://news.google.com/rss/articles/CBMieEFVX3lxTE8tNkxNckc1R3lzeFp3eEZkZFhsU0JaNDB5WGhyMVlHWE5aY2hnZkxrb29lVlV2dkswOEhXeHJZRlNqeFlLdjFSMXpGRU5NZ1p1dWtxMjhzQWxLMk5waDBTUU1ET2JlUGM0TlVTZEI5cGJaczh6UkExbA?oc=5,"Tue, 16 Jun 2026 11:22:11 GMT",Google News - SAP,news,SAP News Center,2026-06-22T20:07:38+00:00
a81084cd3692e669,EMSTEEL Adopts RISE with SAP to Strengthen Cloud Foundation for Industrial Growth - SAP News Center,EMSTEEL Adopts RISE with SAP to Strengthen Cloud Foundation for Industrial Growth SAP News Center,EMSTEEL Adopts RISE with SAP to Strengthen Cloud Foundation for Industrial Growth - SAP News Center. EMSTEEL Adopts RISE with SAP to Strengthen Cloud Foundation for Industrial Growth SAP News Center,https://news.google.com/rss/articles/CBMitwFBVV95cUxQTHQwWkx5dmpIZ3FiZXFCWDJUTmxFR3B2TXg3TDZpUjUzZ05rNFlnazAyZkFWcWRlaGJXWkN6bHdaSEhiLXVwbVhsQVpOdnNneG9xNFctVFkyUmtHaVh2X1V5SVVXYV8tMWNXMzZ3ckpfRzRLUTJaNkZrTmRSNmNPQzdETE91WGc1ajZyRVV6VVhoV20wRWxFTmF3V3JOMjNHRFlaTUY0aXFFY3pFTkJSSWwwMVFHaVk?oc=5,"Tue, 02 Jun 2026 07:00:00 GMT",Google News - SAP,news,SAP News Center,2026-06-22T20:07:38+00:00
2602c15ac50b91fb,The Future of Hiring at SAP: SAP Runs SmartRecruiters - SAP News Center,The Future of Hiring at SAP: SAP Runs SmartRecruiters SAP News Center,The Future of Hiring at SAP: SAP Runs SmartRecruiters - SAP News Center. The Future of Hiring at SAP: SAP Runs SmartRecruiters SAP News Center,https://news.google.com/rss/articles/CBMie0FVX3lxTE10ZWVlWXpNQmYxWnFfT25WeDFucXpjU2lKbDl0ekRQSGd5TWNqZGoxNnhUbEU3WTk2ZGg4dFdRaFJUUmhwRGVjUnlpcmhlWjcwNVZ0cFdXNHRpQnN3WjdXQjBFQ2ZSa3k5Mmh5cTRQNXVaT2w2cWZpM3p5Yw?oc=5,"Mon, 08 Jun 2026 11:19:40 GMT",Google News - SAP,news,SAP News Center,2026-06-22T20:07:38+00:00
dfc5097a18eb7757,Where Does AI Adoption Really Start? SAP Discovery Center Has the Answer - ERP Today,Where Does AI Adoption Really Start? SAP Discovery Center Has the Answer ERP Today,Where Does AI Adoption Really Start? SAP Discovery Center Has the Answer - ERP Today. Where Does AI Adoption Really Start? SAP Discovery Center Has the Answer ERP Today,https://news.google.com/rss/articles/CBMiYEFVX3lxTE9USlM0SktEbS0tcDU5WUw0V2JrTXpsYnBDTF81QVNya0d0RzhMZEVlNTROaWJOczRjdTB4SjNOUTB4RUcxLVFvZF9nMTI1Q0Zza0UzbERQdzhtN0VsYTJtVA?oc=5,"Mon, 22 Jun 2026 06:51:43 GMT",Google News - SAP,news,ERP Today,2026-06-22T20:07:38+00:00
9045aaff9051234b,Flagship SAP Event Highlights Impact of Modernisation Efforts at Leading Organisations - SAP News Center,Flagship SAP Event Highlights Impact of Modernisation Efforts at Leading Organisations SAP News Center,Flagship SAP Event Highlights Impact of Modernisation Efforts at Leading Organisations - SAP News Center. Flagship SAP Event Highlights Impact of Modernisation Efforts at Leading Organisations SAP News Center,https://news.google.com/rss/articles/CBMiwAFBVV95cUxQSktCeFlSQThZem12N3dWZjR6eUhVTTByUFk4N0hPUmNnRGVNU0dyOEJRR2k2N0JRYzFKSkhrNkIyWTJsd1VyWnhuVkw0LWN5blBVaU1LdUpnMFRTTzA2eThuczNXYzJWdjFyWW4yQndYWUNJNkxWTEJ4b0E4dmhtcHNPNlRULUJhdUM3UXdSU0dtWFhIOXFoZUJSeFM3OWpZejRVdm53c3dWUHFWZWJrYUdJbWlSbzY3SDRPdUsxaFI?oc=5,"Thu, 11 Jun 2026 10:52:04 GMT",Google News - SAP,news,SAP News Center,2026-06-22T20:07:38+00:00
4e41632a6c544efc,SAP Labs India Unveils 2026 Startup Studio Cohort Focused on Enterprise AI and Deep-Tech Innovation - SAP News Center,SAP Labs India Unveils 2026 Startup Studio Cohort Focused on Enterprise AI and Deep-Tech Innovation SAP News Center,SAP Labs India Unveils 2026 Startup Studio Cohort Focused on Enterprise AI and Deep-Tech Innovation - SAP News Center. SAP Labs India Unveils 2026 Startup Studio Cohort Focused on Enterprise AI and Deep-Tech Innovation SAP News Center,https://news.google.com/rss/articles/CBMi0AFBVV95cUxOZlpiTWVrXzJCSkpzc2xkR0Y5RTVfdDNicjRhM2J0ZG93ZVFTaFlMZXBuMXBRNGJ5V2RhcXlkR2pKbmV3Q0lpeThlb3B5Yk50M3RVbDBRWmJTZmkzcmZWVlpXTVhZUFF1MW1Tc2VnVjBPejN2ZGtJTGVSWTZtRjFrRk9YTXgzU0kwWV9jdzNfeDRhS05pRUN0LVI5by03WWQ5bF96b3FsWG1weERCTHhrNzZWdFZ0Yi1uRzhJT01OLXByLXBrVlJWYjZGOWpvUEo0?oc=5,"Tue, 16 Jun 2026 12:00:33 GMT",Google News - SAP,news,SAP News Center,2026-06-22T20:07:38+00:00
b1b2c03ab1cecc8b,Embedded AI must be a Board-level Priority in 2026 - SAP News Center,Embedded AI must be a Board-level Priority in 2026 SAP News Center,Embedded AI must be a Board-level Priority in 2026 - SAP News Center. Embedded AI must be a Board-level Priority in 2026 SAP News Center,https://news.google.com/rss/articles/CBMikAFBVV95cUxOTkVCOFNYS1VDemFkVEQ4czZlalVJLWdtakJZNmZ2UHpnc3Y1aVQ2NXBQZDROTC0wUWlFeURBQThqN0Z0WUwxZ2xpY3ZuWDVDWjZudl9QOFhma0JRUjBRUEtqLXpGNkdkMXBvUHhRNGdmRXRfM0VKRzZlUHB0a1FHd1pacWxqRk1TYk5DV19Wd1c?oc=5,"Thu, 18 Jun 2026 09:06:40 GMT",Google News - SAP,news,SAP News Center,2026-06-22T20:07:38+00:00
a2e0b484d812ba5e,"Conduct Raises $60 Million Series A Round from Index, ICONIQ, and SAP - Yahoo Finance","Conduct Raises $60 Million Series A Round from Index, ICONIQ, and SAP Yahoo Finance","Conduct Raises $60 Million Series A Round from Index, ICONIQ, and SAP - Yahoo Finance. Conduct Raises $60 Million Series A Round from Index, ICONIQ, and SAP Yahoo Finance",https://news.google.com/rss/articles/CBMinAFBVV95cUxPOEF3cy1ZNk90bjRkN0JMc1ZNUlE1Wjlqd3B1aDRFYTQ4aTNILU55Zk9oTFVuUV9vbV9DX2p1TG1XaXZiOXc0M0hFVEQzeVdmaG85eFZiUk1SZllERkpPRWpiYVQwY1l5ME5qQ1o5NHdnY2Z4TWRaYU16eVlpcUVKMDA4NmIwam5MQ2NWWHNRUUpydzJjQThBTTF4X3Y?oc=5,"Wed, 17 Jun 2026 12:15:00 GMT",Google News - SAP,news,Yahoo Finance,2026-06-22T20:07:38+00:00
2463bec28c3b0012,The rise of governed autonomy - IBM,The rise of governed autonomy IBM,The rise of governed autonomy - IBM. The rise of governed autonomy IBM,https://news.google.com/rss/articles/CBMikwFBVV95cUxQcjFDdlBfNFNwY1ppLV9fUkhKUnFQaktmc0JzcXRVdHdiUmJNT0M2N0lCUlh0RlA3OTQxNF9fYWF4bWx1T0lMNmVmbXBVblBrc1lPZFV4UTdmQmZJV2FtZG5PVEhXcHZ0QzhlZGgzbzhzbGdxRHdiU0p4bnR3VXp5N1U3YkotdmNpTjFSUy13Zy0tYU0?oc=5,"Wed, 17 Jun 2026 12:19:41 GMT",Google News - SAP,news,IBM,2026-06-22T20:07:38+00:00
7657dc0a7173871f,Is SAP Staging A Comeback? (NYSE:SAP) - Seeking Alpha,Is SAP Staging A Comeback? (NYSE:SAP) Seeking Alpha,Is SAP Staging A Comeback? (NYSE:SAP) - Seeking Alpha. Is SAP Staging A Comeback? (NYSE:SAP) Seeking Alpha,https://news.google.com/rss/articles/CBMidEFVX3lxTE93a2Ftcm01dWF4UXM5YlRaeHgtOVJ0NV9uQU45R1Rkd3RrVGlIc3pDbkRWbDN2UWp2WEdvb2dxei1iYTZwcWZUR3hDV0tvR0NXbWZsMzRlSGs2RmZWcnRsWnd6a1cycXBUY01WRU4wZFNsREJI?oc=5,"Wed, 03 Jun 2026 07:00:00 GMT",Google News - SAP,news,Seeking Alpha,2026-06-22T20:07:38+00:00
267126694d611a3d,Reimagining the Supply Chain: Turning Strategic Vision into Operational Reality - SAP News Center,Reimagining the Supply Chain: Turning Strategic Vision into Operational Reality SAP News Center,Reimagining the Supply Chain: Turning Strategic Vision into Operational Reality - SAP News Center. Reimagining the Supply Chain: Turning Strategic Vision into Operational Reality SAP News Center,https://news.google.com/rss/articles/CBMinAFBVV95cUxQamJELUpwTmVaaVotVEhIYjB2WExWczMxVlI2dGU0YlpXU1pYRmtPSm1Bem55ZElnM3VKZWtTUEc5b1pRVnljRTQ4RkQ0SUQwRWNhcGdNLU9sWlN2SEJtc0hFMDUyVFg4OWdONUhTRklucXdVdHotaWxwY0Ixb3czc0hmZTR4RWtjbW45NXRFaW81Y0d1Snc0R1pBb1A?oc=5,"Wed, 17 Jun 2026 11:18:23 GMT",Google News - SAP,news,SAP News Center,2026-06-22T20:07:38+00:00
6a3a28b42a799da7,"The Next Enterprise AI Wave Will Reach Beyond Agents, Says SAP Labs US Managing Director - ERP Today","The Next Enterprise AI Wave Will Reach Beyond Agents, Says SAP Labs US Managing Director ERP Today","The Next Enterprise AI Wave Will Reach Beyond Agents, Says SAP Labs US Managing Director - ERP Today. The Next Enterprise AI Wave Will Reach Beyond Agents, Says SAP Labs US Managing Director ERP Today",https://news.google.com/rss/articles/CBMibEFVX3lxTE9Tc0VSYlF5dWR5ZTNXY1dneks4Smd1SjNYSnAySmtuWTYyRTVFOFBmXzg5bVFUQTNDUkFyVlNyZkFwdmdqcTgwbkdjYkxEN3N5a05qWTZvZnZJYWJESV9uUUQ4S1ZKWnQ5TGMwVQ?oc=5,"Tue, 09 Jun 2026 13:45:57 GMT",Google News - SAP,news,ERP Today,2026-06-22T20:07:38+00:00
8a8f6a59d8a8d85f,"SAP Autonomous Suite: Inisights from Jan Gilg, Pres. for Customer Success - Cloud Wars","SAP Autonomous Suite: Inisights from Jan Gilg, Pres. for Customer Success Cloud Wars","SAP Autonomous Suite: Inisights from Jan Gilg, Pres. for Customer Success - Cloud Wars. SAP Autonomous Suite: Inisights from Jan Gilg, Pres. for Customer Success Cloud Wars",https://news.google.com/rss/articles/CBMisAFBVV95cUxQVmVZbDdIaVZyS1MxMVljNzVRNE5pUnBQTGNIV2JncmpIQk5xZTBxbW9rOWR5RFNEcFF1NVpXdGMtU3duM2s3elNwMFRZelBKNDBFNDhKWm5jNVZLQUJEeUlZRFR5X3J3a054eEtrSk1DTkdyU0V3S1B1TTZwWmFkbUtTWlZRMEJMWkhvRWR1TjNTYnhOQTUtMEZybUhkVkpjVi1DMG5RaTRmVGN4a29fYQ?oc=5,"Fri, 12 Jun 2026 11:30:00 GMT",Google News - SAP,news,Cloud Wars,2026-06-22T20:07:38+00:00
7ee9f54184f24169,SAP Exit Strategies for the Cloud and AI - E3-Magazin,SAP Exit Strategies for the Cloud and AI E3-Magazin,SAP Exit Strategies for the Cloud and AI - E3-Magazin. SAP Exit Strategies for the Cloud and AI E3-Magazin,https://news.google.com/rss/articles/CBMib0FVX3lxTFBpeWl5bzJxdzRyWEkxOGZ4TF94ZmhJMUVWRktVdW5xRG4tTHJXdVNtdWlqWVI4aExDOUxJQVJBZF9HLXkxMmV3c2owR2hRUXlTbVIyU3hib25xcXBRd1JBSjlJaTFoc0kzNGJoeGs3Zw?oc=5,"Thu, 18 Jun 2026 09:12:20 GMT",Google News - SAP,news,E3-Magazin,2026-06-22T20:07:38+00:00
59f3329c8a67ca39,Clean Core: The discipline driving real results from SAP - DXC Technology,Clean Core: The discipline driving real results from SAP DXC Technology,Clean Core: The discipline driving real results from SAP - DXC Technology. Clean Core: The discipline driving real results from SAP DXC Technology,https://news.google.com/rss/articles/CBMiowFBVV95cUxQZ0M5cjhvZm50NjZsQ1AzY2tmNTYySHlIREFaaXBNUzZ6VFN3VWFiaEN4dEl4NDZMaExKUVc4RUEtajE2YVFCTjhOOU42U3lPMFFyRFlnMThEZ2ZIa3hqRzJrZGFrakQ1S0xpZEpFUkVxWms5MDg0TngwZGllVHg2SjVyZWVWSVNfVVctZC1IX3JRX0xkZ3BNWnNSVnpFVUFRVlFB?oc=5,"Tue, 26 May 2026 07:00:00 GMT",Google News - SAP,news,DXC Technology,2026-06-22T20:07:38+00:00
0dd883a22739112a,"‘AI Is a Business Challenge, Not an IT One; Data Is the IT Problem,’ Q&A with Armstrong World Industries - ERP Today","‘AI Is a Business Challenge, Not an IT One; Data Is the IT Problem,’ Q&A with Armstrong World Industries ERP Today","‘AI Is a Business Challenge, Not an IT One; Data Is the IT Problem,’ Q&A with Armstrong World Industries - ERP Today. ‘AI Is a Business Challenge, Not an IT One; Data Is the IT Problem,’ Q&A with Armstrong World Industries ERP Today",https://news.google.com/rss/articles/CBMigAFBVV95cUxPYjRTek5VdHBPM1J5dVFlQmJWTTNpWmRZY0RsSms4d3ZXVnR5eW1hbnNqZ2pnRlN4aW9zZUUxVUNPb0hfYjlSTzFPUXROTHRPM3hselZ4M2RjY2duUi0tRzg0VTlBYTk5djNyOUY2cVRNdVRZaGdzRExhN19nNE1KNQ?oc=5,"Thu, 11 Jun 2026 05:05:39 GMT",Google News - SAP,news,ERP Today,2026-06-22T20:07:38+00:00
bd5707d0c899199d,Qorelo Raises $3.5 Million To Accelerate AI-Powered SAP Transformations - Pulse 2.0,Qorelo Raises $3.5 Million To Accelerate AI-Powered SAP Transformations Pulse 2.0,Qorelo Raises $3.5 Million To Accelerate AI-Powered SAP Transformations - Pulse 2.0. Qorelo Raises $3.5 Million To Accelerate AI-Powered SAP Transformations Pulse 2.0,https://news.google.com/rss/articles/CBMilAFBVV95cUxQNm9lTXRfOS12Sjk4OTBTNTlyeXFyNThUWWpPVzY4NUZDN01mRDY0WGhSYUlPdk1LZUVRMUs4ajJ6UjRqT2lva054ZVdqT2wtbTlRbVNLaUFmRnZHbGF2MG5UWHlHeFhYODJHajFiNlM4S0RPSjdhRDFsV2U2R3VwMGNBM25SRWdXaWx1Wmo4SHRyMmx10gGaAUFVX3lxTE1rdHR5MGFQbkNYNkZna2lZWmFyNFd6eUNZS3FqeDRZTUt6YjVpaDRTY2dQQ24yUW9jNnFaMThYZXFPVEk3RmR2M2NOdU5Da2M1WmJ1VXN5RWVYZkVJbFR0NGdhZnhIQmxucWRCV3ZJZkZGVVhncWhMYWtQandBUzVrOGpKOFBwSWx5bnZTTlhsX3QyNmdmRjQ1N1E?oc=5,"Mon, 15 Jun 2026 10:31:09 GMT",Google News - SAP,news,Pulse 2.0,2026-06-22T20:07:38+00:00
053424130c01a2f5,"Conduct Raises $60 Million Series A From Index Ventures, ICONIQ, And SAP - Pulse 2.0","Conduct Raises $60 Million Series A From Index Ventures, ICONIQ, And SAP Pulse 2.0","Conduct Raises $60 Million Series A From Index Ventures, ICONIQ, And SAP - Pulse 2.0. Conduct Raises $60 Million Series A From Index Ventures, ICONIQ, And SAP Pulse 2.0",https://news.google.com/rss/articles/CBMikwFBVV95cUxObDdPcUVwREdMNGRUeTRLYzdFeklkVzREZFpnWmdJdThJdkQ3dEZTQnZqZUkxUEU3cE50Y0RzT2pJMHpFNGNrTG4wQzlVSFltbGNybmZ0eUxvdElhbFlCTUJOdzdNZ2l1a0RYUDBpbzIybXMtVy1nczViN1hhejdvWlRWdVJmUE5BT2Z2cXUzYlQ2dFHSAZgBQVVfeXFMUGE0R3pER0hMa21YZ3RmZjlSaW5PTGRrbDdROFhxUDd1NC1EeVo3OEpValJxWUc1OUpkYU9qRUdrNHlnRnI5aVhYUmhEZzktc29HeFBMYzBrb3BXREFXN19RWFFUZkF6RmdRYnBwZ0lzSXJjUWlOUnlQdUJ3LXNWNU9XUktRSVg0azJ4YjlBTmctd2x4cHVYbmE?oc=5,"Wed, 17 Jun 2026 12:13:54 GMT",Google News - SAP,news,Pulse 2.0,2026-06-22T20:07:38+00:00
c709f4629961273e,SAP Headless UI vs. SAP API Policy - E3-Magazin,SAP Headless UI vs. SAP API Policy E3-Magazin,SAP Headless UI vs. SAP API Policy - E3-Magazin. SAP Headless UI vs. SAP API Policy E3-Magazin,https://news.google.com/rss/articles/CBMiZkFVX3lxTE5jdEZPNHNVY0ROQ1NpNElvLWJhN3EtTkNmODR5Z1Z1TVZ3cWdRMnZjSWpubEpJaGJ0Und5V2FVLWRGamRHU0xWTVV1MEZFcy1yTk1SNEZTUF8yXzdjRkg0Q29HajlHZw?oc=5,"Thu, 11 Jun 2026 11:03:19 GMT",Google News - SAP,news,E3-Magazin,2026-06-22T20:07:38+00:00
