id,title,content,text,url,published,source,source_category,publisher,collected_at
c7acbc29665c9a60,EMSTEEL adopts RISE with SAP to strengthen cloud foundation for industrial growth - Intelligent CIO,EMSTEEL adopts RISE with SAP to strengthen cloud foundation for industrial growth Intelligent CIO,EMSTEEL adopts RISE with SAP to strengthen cloud foundation for industrial growth - Intelligent CIO. EMSTEEL adopts RISE with SAP to strengthen cloud foundation for industrial growth Intelligent CIO,https://news.google.com/rss/articles/CBMixgFBVV95cUxQQ2tqaW1EcVo0NjhhaURvOVF1VU0wSWdfbl9IV1V3NWREZTVIY1ZDOUJYanJ3NFgyeEhZTUFoaEFqOFFhcTd3eXpsRDdkcWFIR0ZoS2Q3THh1RUtLV2QxYi0wWTR2TzlwdTBPOGpSaXBPY094emVnNHhwY3ZnQUwycXlrRlZMMjFOTk9jMXRCOXhxLWdpdzd0WE13dUhmQUx3d0NhOXF3eDd1cXEybkliX2gzOE9iM2xoXzRHTEtjX1JiUEMxQkE?oc=5,"Tue, 02 Jun 2026 09:40:48 GMT",Google News - SAP,news,Intelligent CIO,2026-06-22T20:07:38+00:00
1db7aaab6a609d54,What Is SAP Knowledge Graph? | Explained By An SAP Expert Sir David Attenborough (J2cvRJlMhQ) - Mshale,What Is SAP Knowledge Graph? | Explained By An SAP Expert Sir David Attenborough (J2cvRJlMhQ) Mshale,What Is SAP Knowledge Graph? | Explained By An SAP Expert Sir David Attenborough (J2cvRJlMhQ) - Mshale. What Is SAP Knowledge Graph? | Explained By An SAP Expert Sir David Attenborough (J2cvRJlMhQ) Mshale,https://news.google.com/rss/articles/CBMiW0FVX3lxTE1PVWRvS2JRZTdSMW5ibnNOLVRTbTZjeFdZc09ha0ZvMVhsU1ctOGJFeXk5VloyeUJUUUY1QXI3WEV6UjhqOFFPVjdRYmN4bzZQcnBIOWtBeEhvWWs?oc=5,"Sat, 20 Jun 2026 03:59:35 GMT",Google News - SAP,news,Mshale,2026-06-22T20:07:38+00:00
b47b4e867d6141ff,"As Demand for AI Execution Grows, enosix Launches arnold™ - The Norfolk Daily News","As Demand for AI Execution Grows, enosix Launches arnold™ The Norfolk Daily News","As Demand for AI Execution Grows, enosix Launches arnold™ - The Norfolk Daily News. As Demand for AI Execution Grows, enosix Launches arnold™ The Norfolk Daily News",https://news.google.com/rss/articles/CBMi-AFBVV95cUxPUGk5dHZmQnM2VHBuTDg1ckdRTEdSb285QzNJYUZZRUV2RVNfYVIySEJ4cTF1WHI1Y1l4cTRjVC04SGM0b29idzlWUGFfODIyUjY0ZC12dlhibnVxMHF2anh2Q1VkdmRydDc4Q2JUSnBET1NKU3R0aEdFWXYwUVRmeXRHQnJpS19tTktlQk1BT0Flc0ZIRGFUbWFjeGlyQ3ZtV3g2SEhQcjR2UjJUUzREclN4dTJacml5c3VVTVhfMDZ1TTc5c3N2XzVUcGxDZ2lzbTJrRlA4SzBta3RRWDV0QVo0WW8xb0tqMDIybjRrRmF6a2VCMVNZMA?oc=5,"Tue, 16 Jun 2026 13:00:00 GMT",Google News - SAP,news,The Norfolk Daily News,2026-06-22T20:07:38+00:00
829359b8e065f664,"AI-Fueled IPO Leader Navan Tests Breakout And Takes On Legacy Giants AmEx, SAP - Investor's Business Daily","AI-Fueled IPO Leader Navan Tests Breakout And Takes On Legacy Giants AmEx, SAP Investor's Business Daily","AI-Fueled IPO Leader Navan Tests Breakout And Takes On Legacy Giants AmEx, SAP - Investor's Business Daily. AI-Fueled IPO Leader Navan Tests Breakout And Takes On Legacy Giants AmEx, SAP Investor's Business Daily",https://news.google.com/rss/articles/CBMirgFBVV95cUxPcmNrS0I4OW5TaC1OQmhtSVU5S3JjeUstVXZ1OE93NU5DSkxsenRqNTgwc1NzbVNOeUZ2aWZ3YzlRWUxselJtdnVNdmpXQ0FPRTRtMmhLV1VMMTdDLXpLMlg5MnNJc28yb0J4TlNBdGx1YlFhU0hCNTdKWmljN2x6dUdfVU5OaFdFNjkzblJlU3k1TVVFQWRKNV9qT0d2Q0JSS2tVeW9lRXRJMDFjbnc?oc=5,"Fri, 05 Jun 2026 07:00:00 GMT",Google News - SAP,news,Investor's Business Daily,2026-06-22T20:07:38+00:00
9ca87cc46f65e0de,"AI and Quantum Wonders Keep Happening: TeamViewer, SAP, and Aspermont Soaring, Palantir Sidelined - news.financial","AI and Quantum Wonders Keep Happening: TeamViewer, SAP, and Aspermont Soaring, Palantir Sidelined news.financial","AI and Quantum Wonders Keep Happening: TeamViewer, SAP, and Aspermont Soaring, Palantir Sidelined - news.financial. AI and Quantum Wonders Keep Happening: TeamViewer, SAP, and Aspermont Soaring, Palantir Sidelined news.financial",https://news.google.com/rss/articles/CBMiwwFBVV95cUxQaC1GYWxmN3JySnNJeTlMUlVLeGZuUDJIRVM2WFlNU2N3NzZkXzJNeWZRVkttckotZVB2aDBaSzljRW5kN0pwVHRVU0htMU5LZGpDYXhjVW03M1l2NU41QVRSZXdoZmcyMVJWN0VSbU9ua1FhcnNJVzRaUkF6a3VvRHlINXpxUnhXendNemZIOC1qNkNkbklIT29GUTVxMVRJajhmMjVMeEJjZmh1YmN5RTFYUl9GblVqRVFKN1hjNmZ6WEU?oc=5,"Fri, 05 Jun 2026 06:08:20 GMT",Google News - SAP,news,news.financial,2026-06-22T20:07:38+00:00
4a18d46060cf6a61,3 AI Stocks Combining Earnings Growth With Valuation And Debt Questions - simplywall.st,3 AI Stocks Combining Earnings Growth With Valuation And Debt Questions simplywall.st,3 AI Stocks Combining Earnings Growth With Valuation And Debt Questions - simplywall.st. 3 AI Stocks Combining Earnings Growth With Valuation And Debt Questions simplywall.st,https://news.google.com/rss/articles/CBMi0gFBVV95cUxNUG5yNDhNRkE4djNDLVphbU82MlhYTFdnNmJMWUNJSTJEMHU3ZlR4TlVPRnc0UzN2ekZuNVpRVy1Yck9PZ3kwSmFLekJldml5UHFFNE9hazhmNnBsLUpCTFBCVFhPU3lEZHFSMWVyWFc0ZnpBdkppSUxFMzJsNzNvbzgxcWI3X1AwSTdrWFFKQmYtdHRubmEzalRCUGtGODBXVE1HdkxVY2RKZGFQYlJPelVLcm5fSy1LRUI5T0lQOF9LTXVodmVRSS0yazFlbWhMeUHSAdcBQVVfeXFMUGp0eU43bFZBMkhwLXd4dEdxa1F5emNTOVQ5aHk5M0JzUjZtTXB6YnNWOF9OUUV6OV9hbzM2X0dUU2x2U05lMy1TaExqbnpfeVFzbUZiZDBucDZBMjRxQ3Nza2stN3Zock1LWnN5MkJMQ04zNUxyUEJhRGQ5UVlWNDZJbzBqSENDSFBXSG5WVXdVUlZzeHloRTItNjZQZWh4MHU3ZDdBb2hxaWZwemtjbFQ4TW9fTjlqZjd6MWVHV0JrTXRDdnh5UmFvOE1DcjNrQjJwRFg3eWM?oc=5,"Sat, 20 Jun 2026 16:55:44 GMT",Google News - SAP,news,simplywall.st,2026-06-22T20:07:38+00:00
8404dda79f89bae5,"Pathlock, NTT DATA Launch Managed SAP Security Service - Channel Insider","Pathlock, NTT DATA Launch Managed SAP Security Service Channel Insider","Pathlock, NTT DATA Launch Managed SAP Security Service - Channel Insider. Pathlock, NTT DATA Launch Managed SAP Security Service Channel Insider",https://news.google.com/rss/articles/CBMinAFBVV95cUxQZzhMMkVHVHhmd0JSa3FQWFlYUzc1SXBpMEZpbXI2SHpxc09Zb0JQdVJwS2ZwWFVycHQ1bnpQSDFlWk9jRlJWU1pmaW1oVmsyeTVjN0JwUGV3OGpTNFJNdnplUEVTVXNLcTlDM1BMRk9lemhoOVgyakUyb1VCVTRGaXhtWDgyT0gwdzU3TkJTSFJfUEQ4d1duUFo3Qno?oc=5,"Tue, 16 Jun 2026 13:07:30 GMT",Google News - SAP,news,Channel Insider,2026-06-22T20:07:38+00:00
bca838775eacde12,SAP chief predicts AI will replace its human coders within four years - AFR,SAP chief predicts AI will replace its human coders within four years AFR,SAP chief predicts AI will replace its human coders within four years - AFR. SAP chief predicts AI will replace its human coders within four years AFR,https://news.google.com/rss/articles/CBMitwFBVV95cUxQcjFLMTd5R3l4VllGLU0wUEJZd1VOWGhWOGZPcnMtckdrcFRvUDRtdzlpR1RKbWtzZkdNXzRnX2w0azJBRlNUN19GOG5YQllaNEUzRTlFbGFvbzVjWFY3czI2QjdQc0xScUhQTk13RkI3Z1hxOUVLQ1dBSWkwMEQ2b0JhQXFnZjQxMlppenN0R3dQS0ZBRVBMM1pjWnJodFo4dVZHc0NqOXhmOXpYbVVDNjVoR181TDg?oc=5,"Sun, 21 Jun 2026 06:00:00 GMT",Google News - SAP,news,AFR,2026-06-22T20:07:38+00:00
8810e0e8cef836ab,The SAP EWM Skills Worth Pursuing in 2026 - IgniteSAP,The SAP EWM Skills Worth Pursuing in 2026 IgniteSAP,The SAP EWM Skills Worth Pursuing in 2026 - IgniteSAP. The SAP EWM Skills Worth Pursuing in 2026 IgniteSAP,https://news.google.com/rss/articles/CBMickFVX3lxTE11YXlTUWk3cUdHTW9pTFJmYkd3Z1hfRjNhU2RzcnFRYWJvR1p5azhoMldKaHJfcFlDVEJLRmZwaVZnSWIwdHZYQ3FtT1p4U0pLM2JXLTVhTFVlMFNCSHVuUE1feDhweG04T3Zwc2MxOWtiUQ?oc=5,"Thu, 18 Jun 2026 09:38:12 GMT",Google News - SAP,news,IgniteSAP,2026-06-22T20:07:38+00:00
e5ca66b6d9d9ffe7,"SAP June Patch Day Brings Four Critical Fixes Across NetWeaver, ABAP, Commerce Cloud - ERP Today","SAP June Patch Day Brings Four Critical Fixes Across NetWeaver, ABAP, Commerce Cloud ERP Today","SAP June Patch Day Brings Four Critical Fixes Across NetWeaver, ABAP, Commerce Cloud - ERP Today. SAP June Patch Day Brings Four Critical Fixes Across NetWeaver, ABAP, Commerce Cloud ERP Today",https://news.google.com/rss/articles/CBMikAFBVV95cUxQQlhfYVlDUmtfd0JJLWNBaHE5WTBjcmdvNS0xWHY5VGU1TXFza1UzbExnUkwzWG1memI2cDEzQzNWREJtWklNMjcwYUJCR1NoWG5iUF9qZ1lJdjBEcmtrczZMcDZIQzJsVkJLSHNwVnNpZWdlX1lnZ1lQR2dKTHRoOTVqZHo1VmZFU1FDb2xWTEw?oc=5,"Thu, 11 Jun 2026 05:29:49 GMT",Google News - SAP,news,ERP Today,2026-06-22T20:07:38+00:00
07a52f60f98ef5c0,SAP India Notes Boards Shift to AI Cost Focus - Let's Data Science,SAP India Notes Boards Shift to AI Cost Focus Let's Data Science,SAP India Notes Boards Shift to AI Cost Focus - Let's Data Science. SAP India Notes Boards Shift to AI Cost Focus Let's Data Science,https://news.google.com/rss/articles/CBMikAFBVV95cUxOVWVUcFNnTUdwcmNSVXg4VXJOMWQ4cXgxVU9GNGV3Z3IyUlMxYlg3T1phdWZkNW5GQmpwZTQ4UUpEcTFIV2dBRzA4UWJnWWk0akpESUh1TWJVT21UV2pqSEx6TVV0Wm9PdkVyampqdHR6Q1FJWElodkZsNUQ0aDBFbTFNYlNTcE9MbHp1dGNzamM?oc=5,"Sun, 14 Jun 2026 06:54:10 GMT",Google News - SAP,news,Let's Data Science,2026-06-22T20:07:38+00:00
2c184203dc4db640,SAP and Google Cloud Deploy Agentic Commerce Architecture - Let's Data Science,SAP and Google Cloud Deploy Agentic Commerce Architecture Let's Data Science,SAP and Google Cloud Deploy Agentic Commerce Architecture - Let's Data Science. SAP and Google Cloud Deploy Agentic Commerce Architecture Let's Data Science,https://news.google.com/rss/articles/CBMioAFBVV95cUxOSXVWSXBYeDViVW5ic0s3YUNTSVgyZklEQ19NcEZGWGFDVGhLN3MwcVVXdmF2WUpjbXJmNnVwMFZTbzlhT2l3Rmt0RkNNakMxMGZxZ0FQNlctc3R6LTYxal8zUEllVm5EY001cUhDVnRFenNPUlVPakg5NE9UZHY5TC1UMEZST3VDVWNGTjVIc2dqazhhbTVjdUg5NHY2QUdV?oc=5,"Fri, 19 Jun 2026 14:02:20 GMT",Google News - SAP,news,Let's Data Science,2026-06-22T20:07:38+00:00
a8f7290eef123916,SAP And Snowflake Zero Copy Integration Product Demo Liga Mx (3w8VkbfAt7) - Mshale,SAP And Snowflake Zero Copy Integration Product Demo Liga Mx (3w8VkbfAt7) Mshale,SAP And Snowflake Zero Copy Integration Product Demo Liga Mx (3w8VkbfAt7) - Mshale. SAP And Snowflake Zero Copy Integration Product Demo Liga Mx (3w8VkbfAt7) Mshale,https://news.google.com/rss/articles/CBMiW0FVX3lxTE56aTZDcTREYUw1M0ZKYWtYWjRVcTdlUkQ2Q0tiUnF0c0FGUUJxbXFQMERWLXViYWVCYy11MW1TT25acG15dWN0cTZ4R1ZsYWQyODFzU1c0b2o3Qkk?oc=5,"Sat, 20 Jun 2026 08:26:13 GMT",Google News - SAP,news,Mshale,2026-06-22T20:07:38+00:00
f186fd2227935f02,SAP and Google Cloud Develop Agentic Commerce Architecture for Enterprise Retail - entARABI,SAP and Google Cloud Develop Agentic Commerce Architecture for Enterprise Retail entARABI,SAP and Google Cloud Develop Agentic Commerce Architecture for Enterprise Retail - entARABI. SAP and Google Cloud Develop Agentic Commerce Architecture for Enterprise Retail entARABI,https://news.google.com/rss/articles/CBMiswFBVV95cUxONm9DS0FrSW45NGtjdHlFbC1qeHgza2wxVzlHSjdlQ2NPY1E0SnI4V3FKdFF3YXNMb2xuZHFybktoVjgyRWFZWVQ4SUZCUlBEQ19WNHRTQlVoMFJoeDJJaktpN0VNcHR5NzVuNmROUkVabU43OFdiMlZVSGpOX1hFcV9vSE0yaFlrWWpmZGdiTTIzV0xhRkNjRVlqTG91bUtwNWp5eVdPTVdHSlB3cWlodmVvMA?oc=5,"Sat, 20 Jun 2026 19:45:42 GMT",Google News - SAP,news,entARABI,2026-06-22T20:07:38+00:00
b13af6b152989d57,Stockland builds Sage assistant to surface SAP data - Let's Data Science,Stockland builds Sage assistant to surface SAP data Let's Data Science,Stockland builds Sage assistant to surface SAP data - Let's Data Science. Stockland builds Sage assistant to surface SAP data Let's Data Science,https://news.google.com/rss/articles/CBMimAFBVV95cUxNeE1Jb0t4NkVHS3hGRDBWYUlsRWZxcUtIejBsU1ZCeTBGbEw3dEwzamJXc21mWURtdGNhQThYX2VzQUFRT3pVT1JqUW82Z2IyNXRCWlRZMUVOSWpFbTVPU2pCSFdtbEdKdXVDUTBMVkVyNmJaWktVSDctR2o3czNBaldfbmg1ekRzYklHSHE3Vm1vSlBQcWR5cA?oc=5,"Tue, 09 Jun 2026 20:23:00 GMT",Google News - SAP,news,Let's Data Science,2026-06-22T20:07:38+00:00
db8f7a691b2c3991,"3 ex-Palantir engineers raise $60m from Index, Iconiq, SAP for agentic operating system - Sifted","3 ex-Palantir engineers raise $60m from Index, Iconiq, SAP for agentic operating system Sifted","3 ex-Palantir engineers raise $60m from Index, Iconiq, SAP for agentic operating system - Sifted. 3 ex-Palantir engineers raise $60m from Index, Iconiq, SAP for agentic operating system Sifted",https://news.google.com/rss/articles/CBMiW0FVX3lxTE9GeTRSZE00NWszV2hNTUZFY1hVekRqQ29XYlhGaDNxZGNyQXBEUUNkQzVuQlhVSFRqVU53OFVoaU16cVZ5Q1haNVRRMUlDanQwSFhCZHRGUi1sLU0?oc=5,"Wed, 17 Jun 2026 12:02:13 GMT",Google News - SAP,news,Sifted,2026-06-22T20:07:38+00:00
18c66985aac722f1,Anthropic IPO: Platform vs. Product [Comprehensive Research] [2026] - Klover.ai,Anthropic IPO: Platform vs. Product [Comprehensive Research] [2026] Klover.ai,Anthropic IPO: Platform vs. Product [Comprehensive Research] [2026] - Klover.ai. Anthropic IPO: Platform vs. Product [Comprehensive Research] [2026] Klover.ai,https://news.google.com/rss/articles/CBMijAFBVV95cUxOdm5yUVFjeTBBX2NHb1hHdlBDR1dFaEVEY2tjbFNPNmF1MkRTVVZFekR2U2lLLVNWNVRGcFpxOVBfVmE1eklZRUJTQ3poSERhV19ScjVZWXFRcGlRVTZKVVQtSEJQckJ5Ump2TXVPWnExVjJZTGpJbnJxVGwtYjh5dTFvbW1acF9hSkl5Zw?oc=5,"Wed, 10 Jun 2026 10:44:52 GMT",Google News - SAP,news,Klover.ai,2026-06-22T20:07:38+00:00
931d4464715f4767,Qorelo raises $3.5M to streamline SAP migrations - Tech.eu,Qorelo raises $3.5M to streamline SAP migrations Tech.eu,Qorelo raises $3.5M to streamline SAP migrations - Tech.eu. Qorelo raises $3.5M to streamline SAP migrations Tech.eu,https://news.google.com/rss/articles/CBMif0FVX3lxTE1xTmdrZGxXbk1mdmdMSFZtY2E3NlJZNW1hMkczbldOb0RFSjRRaVZSQ3g3RERFLUlya1I2REptSzl2QjFNS3BxRzVVSTRTTVJ4QWRaQURDX0JyMERWMUs1aV9OWXhnU3R5VWJvN3B3U3lUcndoWFhTNEhwcU5Xb3c?oc=5,"Mon, 15 Jun 2026 06:17:06 GMT",Google News - SAP,news,Tech.eu,2026-06-22T20:07:38+00:00
da8744cb4c807e68,XTEL Revenue Growth Platform Now Available on SAP® Store - PR Newswire UK,XTEL Revenue Growth Platform Now Available on SAP® Store PR Newswire UK,XTEL Revenue Growth Platform Now Available on SAP® Store - PR Newswire UK. XTEL Revenue Growth Platform Now Available on SAP® Store PR Newswire UK,https://news.google.com/rss/articles/CBMiswFBVV95cUxQZDdfcnFfNUNNcURqdHJjeEJSaDBMS19pZmZiYzF4Tk9iSGxHWmRGLW5VcUJrbFFSVzloc2FFNk5jeFUzQ0lGVnQ3X3IyUHZudGhkaWFLRE9EWmthSDFFQWtyZkdKMWFRMnJvZ0lYSFBNMVM2OTc5VUJzdUdzMTV0emtGeW41SWM3WlRmMVpEWDZCV1k0ZG1wNkdMam16dWJJRUlMVVpjOU5BZm5UNXd1TUVMNA?oc=5,"Mon, 22 Jun 2026 12:00:00 GMT",Google News - SAP,news,PR Newswire UK,2026-06-22T20:07:38+00:00
5c4d739f310d1b5c,INFRONEER Teams with Accenture to Build New Financial Data and Insights Platform to Advance its Group Management Capabilities in Just Three Months - mykxlg.com,INFRONEER Teams with Accenture to Build New Financial Data and Insights Platform to Advance its Group Management Capabilities in Just Three Months mykxlg.com,INFRONEER Teams with Accenture to Build New Financial Data and Insights Platform to Advance its Group Management Capabilities in Just Three Months - mykxlg.com. INFRONEER Teams with Accenture to Build New Financial Data and Insights Platform to Advance its Group Management Capabilities in Just Three Months mykxlg.com,https://news.google.com/rss/articles/CBMipgJBVV95cUxPNmtZWmNMTWdwYWc2YmxNRWtxb3hGLVlKdHgwUFdvakJ3WVVRWE1ma3pTa3cxWUg3Y08xdXJXYTdCLWI5aW45LUV1ZEJ6OUFKTnh3cENCaUVDNEhNa3BJVWtfSTRWa0Zlcm1GNVhKemJEYkUybnYwLVdHTVlBWGZCWE1NTFRyUXNTelVvR01EWHI0cUVsVE5wNlVjYzJBWEdDSWhIdHg3Z1N5Z0xQZHZEd3I0XzFnZUg3RXFYRWJDSlZsVzNmcEVSOUlETXpEakF5dDFnN1ZDOUNDb2NjalVLdHY3RDlFRWNDaTFUdnZCNlZfem53ZFNsWG5XY1ZmWFQwY0c4bEgwZ1N1dGVFbzN4cXVmbGVWSmY4MVhBVzVmZEJ5VEZpUmc?oc=5,"Mon, 22 Jun 2026 01:59:00 GMT",Google News - SAP,news,mykxlg.com,2026-06-22T20:07:38+00:00
35a04b41d697c3ba,"Canada Needs AI Power, and Control - SAP News Center","Canada Needs AI Power, and Control SAP News Center","Canada Needs AI Power, and Control - SAP News Center. Canada Needs AI Power, and Control SAP News Center",https://news.google.com/rss/articles/CBMiekFVX3lxTE5nc3ZuV1l4a3pYamRLZUxlVjhFMnlKdWl1SUd2MFFVb1VmbWJyTG1qR0k2X2hhRFhsSDZ0eFJNZExMbW56NHVtalZHRERIc1c4bDhwU2VwNk8tbVN0NXNPaUpGd3g2N3FBYVpYRUNBV3dUVUJYU3hUdlRB?oc=5,"Thu, 18 Jun 2026 02:32:28 GMT",Google News - SAP,news,SAP News Center,2026-06-22T20:07:38+00:00
